 ID-EVENTO;TITULO;PRECIO;GRATUITO;LARGA-DURACION;DIAS-SEMANA;DIAS-EXCLUIDOS;FECHA;FECHA-FIN;HORA;DESCRIPCION;CONTENT-URL;TITULO-ACTIVIDAD;URL-ACTIVIDAD;URL-INSTALACION;NOMBRE-INSTALACION;ACCESIBILIDAD-INSTALACION;CLASE-VIAL-INSTALACION;NOMBRE-VIA-INSTALACION;NUM-INSTALACION;DISTRITO-INSTALACION;BARRIO-INSTALACION;CODIGO-POSTAL-INSTALACION;COORDENADA-X;COORDENADA-Y;LATITUD;LONGITUD;TIPO;AUDIENCIA;
11942368;"3 cromosomas de Janira León";"";"1";"0";"";"";"2023-03-31 00:00:00.0";"2023-03-31 23:59:00.0";"18:00";"";"http://www.madrid.es/sites/v/index.jsp?vgnextchannel=ca9671ee4a9eb410VgnVCM100000171f5a0aRCRD&vgnextoid=e7818cc5c9e76810VgnVCM2000001f4a900aRCRD";"";"";"http://www.madrid.es/sites/v/index.jsp?vgnextchannel=bfa48ab43d6bb410VgnVCM100000171f5a0aRCRD&vgnextoid=70d879262ef5d010VgnVCM1000000b205a0aRCRD";"Biblioteca Pública Municipal José Saramago (Fuencarral-El Pardo)";"1,6";"AVENIDA";"MONFORTE DE LEMOS";"38";"FUENCARRAL-EL PARDO";"EL PILAR";"28029";"439867";"4481122";"40.47860087334554";"-3.7094408342979954";"/contenido/actividades/RecitalesPresentacionesActosLiterarios";"/usuario/Niños";
11938364;"Actividad de rol 'La llamada de Cthulhu'";"";"1";"0";"";"";"2023-03-04 00:00:00.0";"2023-03-04 23:59:00.0";"11:00";"";"http://www.madrid.es/sites/v/index.jsp?vgnextchannel=ca9671ee4a9eb410VgnVCM100000171f5a0aRCRD&vgnextoid=360bd8674c376810VgnVCM2000001f4a900aRCRD";"";"";"http://www.madrid.es/sites/v/index.jsp?vgnextchannel=bfa48ab43d6bb410VgnVCM100000171f5a0aRCRD&vgnextoid=0b60e92be3c5e210VgnVCM1000000b205a0aRCRD";"Biblioteca Pública Municipal Iván de Vargas (Centro)";"1,6";"CALLE";"SAN JUSTO";"5";"CENTRO";"PALACIO";"28005";"439775";"4473962";"40.41410290844665";"-3.7098591212735883";"/contenido/actividades/CursosTalleres";"/usuario/Niños";
11937608;"Alzheimer precoz:  importancia del diagnóstico precoz en la enfermedad y terapias evolutivas";"";"1";"0";"";"";"2023-04-12 00:00:00.0";"2023-04-12 23:59:00.0";"11:00";"";"http://www.madrid.es/sites/v/index.jsp?vgnextchannel=ca9671ee4a9eb410VgnVCM100000171f5a0aRCRD&vgnextoid=428a27d55ef66810VgnVCM1000001d4a900aRCRD";"";"";"http://www.madrid.es/sites/v/index.jsp?vgnextchannel=bfa48ab43d6bb410VgnVCM100000171f5a0aRCRD&vgnextoid=70d879262ef5d010VgnVCM1000000b205a0aRCRD";"Biblioteca Pública Municipal José Saramago (Fuencarral-El Pardo)";"1,6";"AVENIDA";"MONFORTE DE LEMOS";"38";"FUENCARRAL-EL PARDO";"EL PILAR";"28029";"439867";"4481122";"40.47860087334554";"-3.7094408342979954";"/contenido/actividades/ConferenciasColoquios";"/usuario/OtrosColectivosNecesitados";
11776601;"Amar la existencia";"";"1";"1";"X";"12/10/2022;9/11/2022;";"2022-09-21 00:00:00.0";"2023-06-28 23:59:00.0";"";"";"http://www.madrid.es/sites/v/index.jsp?vgnextchannel=ca9671ee4a9eb410VgnVCM100000171f5a0aRCRD&vgnextoid=38a384827f543810VgnVCM1000001d4a900aRCRD";"Amar la existencia";"http://www.madrid.es/sites/v/index.jsp?vgnextchannel=ca9671ee4a9eb410VgnVCM100000171f5a0aRCRD&vgnextoid=9ca184827f543810VgnVCM1000001d4a900aRCRD";"http://www.madrid.es/sites/v/index.jsp?vgnextchannel=bfa48ab43d6bb410VgnVCM100000171f5a0aRCRD&vgnextoid=eb9e995a8bf5d010VgnVCM2000000c205a0aRCRD";"Biblioteca Pública Municipal Canillejas (San Blas-Canillejas)";"0,6";"CALLE";"BOLTAÑA";"23";"SAN BLAS-CANILLEJAS";"CANILLEJAS";"28022";"448119";"4477485";"40.44640229188281";"-3.6117933204271098";"/contenido/actividades/CursosTalleres";"";
11896728;"Armenia: orígenes de un lenguaje religioso";"";"1";"0";"";"";"2023-03-01 00:00:00.0";"2023-03-01 23:59:00.0";"19:00";"Antes de que se incorporara al Imperio Romano en 114, el Imperio Armenio se extendía desde el Mar Caspio en el este hasta el Mediterráneo en el oeste. En 301, Armenia se convirtió en el primer país en adoptar el cristianismo como su religión de estado y para el siglo V, la iglesia había desarrollado un alfabeto, que todavía se utiliza hoy en día. Si quieres saber más sobre los orígenes del lenguaje armenio, puedes disfrutar de esta conferencia en la biblioteca o desde casa vía zoom:  ID de reunión 673 720 3049   Código de acceso 6ETT69";"http://www.madrid.es/sites/v/index.jsp?vgnextchannel=ca9671ee4a9eb410VgnVCM100000171f5a0aRCRD&vgnextoid=f1db114bd85a5810VgnVCM2000001f4a900aRCRD";"Ciclo 'El mundo en la palma de la mano'";"http://www.madrid.es/sites/v/index.jsp?vgnextchannel=ca9671ee4a9eb410VgnVCM100000171f5a0aRCRD&vgnextoid=77a9114bd85a5810VgnVCM2000001f4a900aRCRD";"http://www.madrid.es/sites/v/index.jsp?vgnextchannel=bfa48ab43d6bb410VgnVCM100000171f5a0aRCRD&vgnextoid=e791bed05ceed310VgnVCM1000000b205a0aRCRD";"Biblioteca Pública Municipal Eugenio Trías. Casa de Fieras de El Retiro (Retiro)";"1,6";"PASEO";"FERNÁN NÚÑEZ";"24";"RETIRO";"LOS JERONIMOS";"28009";"442345";"4474221";"40.4166091081099";"-3.6795930368034804";"/contenido/actividades/ConferenciasColoquios";"";
11890189;"Aula de Salud Bodyfulness y Mindfulness";"";"1";"1";"J";"6/4/2023;";"2023-01-12 00:00:00.0";"2023-04-27 23:59:00.0";"17:00";"Los jueves a las 17:00 horas";"http://www.madrid.es/sites/v/index.jsp?vgnextchannel=ca9671ee4a9eb410VgnVCM100000171f5a0aRCRD&vgnextoid=06e9de7193375810VgnVCM2000001f4a900aRCRD";"Aula de Salud Bodyfulness y Mindfulness";"http://www.madrid.es/sites/v/index.jsp?vgnextchannel=ca9671ee4a9eb410VgnVCM100000171f5a0aRCRD&vgnextoid=60d9de7193375810VgnVCM2000001f4a900aRCRD";"http://www.madrid.es/sites/v/index.jsp?vgnextchannel=bfa48ab43d6bb410VgnVCM100000171f5a0aRCRD&vgnextoid=628e3d0b5e71c010VgnVCM1000000b205a0aRCRD";"Biblioteca Pública Municipal Ana María Matute (Carabanchel)";"1,6";"CALLE";"ISAAC ALBENIZ";"1";"CARABANCHEL";"SAN ISIDRO";"28019";"438891";"4472167";"40.39786734087938";"-3.720088245008897";"/contenido/actividades/ConferenciasColoquios";"";
11940689;"Bebecuento 'Cuentos de la granja'";"";"1";"0";"";"";"2023-03-16 00:00:00.0";"2023-03-16 23:59:00.0";"17:00";"'¡Manola, Manolita! ¿Alguien ha visto a Manola?' Así aparece Paquita, buscando a su 'vaca más molona'. Mientras la busca hará sonar cencerros, contará cuentos de otros animales que viven en su granja y hará participar a todos y todas en sus alocadas historias. Un cuento teatralizado donde podrán conocerse diferentes personajes y reírse y emocionarse con los cuentos de la granja. Edad recomendada: 8-36 meses. Inscríbete en este enlace.";"http://www.madrid.es/sites/v/index.jsp?vgnextchannel=ca9671ee4a9eb410VgnVCM100000171f5a0aRCRD&vgnextoid=acf04c22c3976810VgnVCM2000001f4a900aRCRD";"";"";"http://www.madrid.es/sites/v/index.jsp?vgnextchannel=bfa48ab43d6bb410VgnVCM100000171f5a0aRCRD&vgnextoid=f05279262ef5d010VgnVCM1000000b205a0aRCRD";"Biblioteca Pública Municipal Francisco Ayala (Vicálvaro)";"1,6";"BULEVAR";"INDALECIO PRIETO";"21";"VICALVARO";"VALDEBERNARDO";"28032";"447278";"4472321";"40.39982891410407";"-3.621281890570377";"/contenido/actividades/CuentacuentosTiteresMarionetas";"/usuario/Niños";
11913903;"Bondad innata";"";"1";"0";"";"";"2023-03-26 00:00:00.0";"2023-03-26 23:59:00.0";"12:00";"Cuarta conferencia del ciclo 'Una cita con el corazón: Cómo cultivar la paz interior', con Luis Castellanos. Acceso libre hasta completar aforo.";"http://www.madrid.es/sites/v/index.jsp?vgnextchannel=ca9671ee4a9eb410VgnVCM100000171f5a0aRCRD&vgnextoid=4daa2ba513806810VgnVCM1000001d4a900aRCRD";"Ciclo 'Una cita con el corazón: cómo cultiva la paz interior'";"http://www.madrid.es/sites/v/index.jsp?vgnextchannel=ca9671ee4a9eb410VgnVCM100000171f5a0aRCRD&vgnextoid=2eeb02f785306810VgnVCM1000001d4a900aRCRD";"http://www.madrid.es/sites/v/index.jsp?vgnextchannel=bfa48ab43d6bb410VgnVCM100000171f5a0aRCRD&vgnextoid=e791bed05ceed310VgnVCM1000000b205a0aRCRD";"Biblioteca Pública Municipal Eugenio Trías. Casa de Fieras de El Retiro (Retiro)";"1,6";"PASEO";"FERNÁN NÚÑEZ";"24";"RETIRO";"LOS JERONIMOS";"28009";"442345";"4474221";"40.4166091081099";"-3.6795930368034804";"/contenido/actividades/ConferenciasColoquios";"";
11802179;"Ciclo 'El traductor, primer lector'";"";"1";"0";"";"";"2023-04-18 00:00:00.0";"2023-04-18 23:59:00.0";"19:00";"";"http://www.madrid.es/sites/v/index.jsp?vgnextchannel=ca9671ee4a9eb410VgnVCM100000171f5a0aRCRD&vgnextoid=546391f7a9d93810VgnVCM2000001f4a900aRCRD";"Ciclo 'El traductor, primer lector'";"http://www.madrid.es/sites/v/index.jsp?vgnextchannel=ca9671ee4a9eb410VgnVCM100000171f5a0aRCRD&vgnextoid=92676f20a6d93810VgnVCM1000001d4a900aRCRD";"http://www.madrid.es/sites/v/index.jsp?vgnextchannel=bfa48ab43d6bb410VgnVCM100000171f5a0aRCRD&vgnextoid=e791bed05ceed310VgnVCM1000000b205a0aRCRD";"Biblioteca Pública Municipal Eugenio Trías. Casa de Fieras de El Retiro (Retiro)";"1,6";"PASEO";"FERNÁN NÚÑEZ";"24";"RETIRO";"LOS JERONIMOS";"28009";"442345";"4474221";"40.4166091081099";"-3.6795930368034804";"/contenido/actividades/RecitalesPresentacionesActosLiterarios";"";
11802178;"Ciclo 'El traductor, primer lector'";"";"1";"0";"";"";"2023-03-21 00:00:00.0";"2023-03-21 23:59:00.0";"19:00";"";"http://www.madrid.es/sites/v/index.jsp?vgnextchannel=ca9671ee4a9eb410VgnVCM100000171f5a0aRCRD&vgnextoid=406391f7a9d93810VgnVCM2000001f4a900aRCRD";"Ciclo 'El traductor, primer lector'";"http://www.madrid.es/sites/v/index.jsp?vgnextchannel=ca9671ee4a9eb410VgnVCM100000171f5a0aRCRD&vgnextoid=92676f20a6d93810VgnVCM1000001d4a900aRCRD";"http://www.madrid.es/sites/v/index.jsp?vgnextchannel=bfa48ab43d6bb410VgnVCM100000171f5a0aRCRD&vgnextoid=e791bed05ceed310VgnVCM1000000b205a0aRCRD";"Biblioteca Pública Municipal Eugenio Trías. Casa de Fieras de El Retiro (Retiro)";"1,6";"PASEO";"FERNÁN NÚÑEZ";"24";"RETIRO";"LOS JERONIMOS";"28009";"442345";"4474221";"40.4166091081099";"-3.6795930368034804";"/contenido/actividades/RecitalesPresentacionesActosLiterarios";"";
11851662;"Ciencia en Casa de Fieras";"";"1";"1";"J";"5/1/2023;12/1/2023;19/1/2023;2/2/2023;9/2/2023;16/2/2023;2/3/2023;9/3/2023;16/3/2023;23/3/2023;6/4/2023;13/4/2023;20/4/2023;4/5/2023;11/5/2023;18/5/2023;";"2022-11-24 00:00:00.0";"2023-05-25 23:59:00.0";"19:00";"";"http://www.madrid.es/sites/v/index.jsp?vgnextchannel=ca9671ee4a9eb410VgnVCM100000171f5a0aRCRD&vgnextoid=b8ea4838cf794810VgnVCM2000001f4a900aRCRD";"Ciencia en Casa de Fieras";"http://www.madrid.es/sites/v/index.jsp?vgnextchannel=ca9671ee4a9eb410VgnVCM100000171f5a0aRCRD&vgnextoid=7ed85eaddd574810VgnVCM1000001d4a900aRCRD";"http://www.madrid.es/sites/v/index.jsp?vgnextchannel=bfa48ab43d6bb410VgnVCM100000171f5a0aRCRD&vgnextoid=e791bed05ceed310VgnVCM1000000b205a0aRCRD";"Biblioteca Pública Municipal Eugenio Trías. Casa de Fieras de El Retiro (Retiro)";"1,6";"PASEO";"FERNÁN NÚÑEZ";"24";"RETIRO";"LOS JERONIMOS";"28009";"442345";"4474221";"40.4166091081099";"-3.6795930368034804";"/contenido/actividades/ConferenciasColoquios";"";
11934477;"Cine Infantil en la Biblioteca María Lejárraga: Cigüeñas";"";"1";"0";"";"";"2023-03-23 00:00:00.0";"2023-03-23 23:59:00.0";"18:00";"En Montaña Cigüeña, viven las cigüeñas que hace tiempo enviaban bebés a los padres de todo el mundo. Ahora distribuyen los paquetes de una compañía mundial de Internet. Junior, la mejor cigüeña repartidora de la compañía, está a punto de conseguir un ascenso, pero accidentalmente activa la Máquina de Producción de Bebés y el resultado es una adorable niña ilegal... Acceso libre hasta completar aforo.";"http://www.madrid.es/sites/v/index.jsp?vgnextchannel=ca9671ee4a9eb410VgnVCM100000171f5a0aRCRD&vgnextoid=9a87d57de5f56810VgnVCM2000001f4a900aRCRD";"Cine Infantil en la Biblioteca María Lejárraga";"http://www.madrid.es/sites/v/index.jsp?vgnextchannel=ca9671ee4a9eb410VgnVCM100000171f5a0aRCRD&vgnextoid=44bf2eeb86e25810VgnVCM1000001d4a900aRCRD";"http://www.madrid.es/sites/v/index.jsp?vgnextchannel=bfa48ab43d6bb410VgnVCM100000171f5a0aRCRD&vgnextoid=d862492de8c8c510VgnVCM2000001f4a900aRCRD";"Biblioteca Pública Municipal María Lejárraga (Hortaleza)";"1,6";"CALLE";"PRINCESA DE EBOLI";"29";"HORTALEZA";"VALDEFUENTES";"28050";"444461";"4482397";"40.49041562546542";"-3.655356751728003";"/contenido/actividades/CineActividadesAudiovisuales";"/usuario/Niños";
11932535;"Cine Infantil en la Biblioteca María Lejárraga: Los Boxtrolls";"";"1";"0";"";"";"2023-03-09 00:00:00.0";"2023-03-09 23:59:00.0";"18:00";"Proyección de la pelícuña The Boxtrolls: Cheesebridge (Puentequeso) es una elegante ciudad de la era postvictorinana, obsesionada por el dinero, la clase y el más delicioso de los quesos apestosos. Debajo de sus encantadoras calles adoquinadas viven los Boxtrolls, unos monstruos que salen de las alcantarillas por la noche para hacerse con los bienes más preciados de los habitantes: sus hijos y sus quesos";"http://www.madrid.es/sites/v/index.jsp?vgnextchannel=ca9671ee4a9eb410VgnVCM100000171f5a0aRCRD&vgnextoid=c7c4f32301a56810VgnVCM2000001f4a900aRCRD";"Cine Infantil en la Biblioteca María Lejárraga";"http://www.madrid.es/sites/v/index.jsp?vgnextchannel=ca9671ee4a9eb410VgnVCM100000171f5a0aRCRD&vgnextoid=44bf2eeb86e25810VgnVCM1000001d4a900aRCRD";"http://www.madrid.es/sites/v/index.jsp?vgnextchannel=bfa48ab43d6bb410VgnVCM100000171f5a0aRCRD&vgnextoid=d862492de8c8c510VgnVCM2000001f4a900aRCRD";"Biblioteca Pública Municipal María Lejárraga (Hortaleza)";"1,6";"CALLE";"PRINCESA DE EBOLI";"29";"HORTALEZA";"VALDEFUENTES";"28050";"444461";"4482397";"40.49041562546542";"-3.655356751728003";"/contenido/actividades/CineActividadesAudiovisuales";"/usuario/Niños";
11942333;"Cine infantil: Lego: la película";"";"0";"0";"";"";"2023-03-13 00:00:00.0";"2023-03-13 23:59:00.0";"17:30";"Cuenta la historia de Emmet, una figurita LEGO absolutamente normal y fiel a las normas que es identificada por error como la persona más extraordinaria y la clave para salvar al mundo. Se ve entonces inmerso en una búsqueda épica para detener a un malvado tirano junto a un grupo de desconocidos, una aventura para la que Emmet no está preparado en absoluto. (reseña Filmaffinity). Entrada libre hasta completar aforo. Edad recomendada: a partir de 6 años.";"http://www.madrid.es/sites/v/index.jsp?vgnextchannel=ca9671ee4a9eb410VgnVCM100000171f5a0aRCRD&vgnextoid=f3808cc5c9e76810VgnVCM2000001f4a900aRCRD";"Cine infantil en la Biblioteca José Saramago";"http://www.madrid.es/sites/v/index.jsp?vgnextchannel=ca9671ee4a9eb410VgnVCM100000171f5a0aRCRD&vgnextoid=ea90d9a3f702f710VgnVCM1000001d4a900aRCRD";"http://www.madrid.es/sites/v/index.jsp?vgnextchannel=bfa48ab43d6bb410VgnVCM100000171f5a0aRCRD&vgnextoid=70d879262ef5d010VgnVCM1000000b205a0aRCRD";"Biblioteca Pública Municipal José Saramago (Fuencarral-El Pardo)";"1,6";"AVENIDA";"MONFORTE DE LEMOS";"38";"FUENCARRAL-EL PARDO";"EL PILAR";"28029";"439867";"4481122";"40.47860087334554";"-3.7094408342979954";"/contenido/actividades/CineActividadesAudiovisuales";"/usuario/Niños";
11927233;"Cinefórum en la Biblioteca La Elipa: 'Muerte en el Nilo'";"";"1";"0";"";"";"2023-03-09 00:00:00.0";"2023-03-09 23:59:00.0";"18:00";"Proyección de la película 'Muerte en el Nilo' en nuestra sesión de Cinefórum. Sinopsis: Basada en la novela de Agatha Christie, publicada en 1937. 'Muerte en el Nilo' es un thriller de misterio dirigido por Kenneth Branagh sobre el caos emocional y las consecuencias letales que provocan los amores obsesivos. Las vacaciones egipcias del detective belga Hércules Poirot, a bordo de un glamuroso barco de vapor, se ven alteradas por la búsqueda de un asesino cuando la idílica luna de miel de una pareja perfecta se ve truncada de la forma más trágica (FILMAFFINITY). Inscríbete en este  enlace  o bien presencialmente en el mostrador de la biblioteca.";"http://www.madrid.es/sites/v/index.jsp?vgnextchannel=ca9671ee4a9eb410VgnVCM100000171f5a0aRCRD&vgnextoid=8964219874b36810VgnVCM2000001f4a900aRCRD";"Cinefórum: 'El callejón de las almas perdidas'";"http://www.madrid.es/sites/v/index.jsp?vgnextchannel=ca9671ee4a9eb410VgnVCM100000171f5a0aRCRD&vgnextoid=c640219874b36810VgnVCM2000001f4a900aRCRD";"http://www.madrid.es/sites/v/index.jsp?vgnextchannel=bfa48ab43d6bb410VgnVCM100000171f5a0aRCRD&vgnextoid=697c598d1351c010VgnVCM1000000b205a0aRCRD";"Biblioteca Pública Municipal La Elipa (Ciudad Lineal)";"1,6";"CALLE";"NUESTRA SEÑORA DEL VILLAR";"6";"CIUDAD LINEAL";"LA ELIPA";"28017";"444705";"4474959";"40.42342659084215";"-3.651841641389484";"/contenido/actividades/CineActividadesAudiovisuales";"";
11761948;"Club de Ajedrez";"";"1";"1";"L";"";"2022-09-05 00:00:00.0";"2023-09-26 23:59:00.0";"18:00";"";"http://www.madrid.es/sites/v/index.jsp?vgnextchannel=ca9671ee4a9eb410VgnVCM100000171f5a0aRCRD&vgnextoid=c6a139a7afdf2810VgnVCM2000001f4a900aRCRD";"";"";"http://www.madrid.es/sites/v/index.jsp?vgnextchannel=bfa48ab43d6bb410VgnVCM100000171f5a0aRCRD&vgnextoid=e4bf3d0b5e71c010VgnVCM1000000b205a0aRCRD";"Biblioteca Pública Municipal Gabriel García Márquez (Usera)";"1,6";"PLAZA";"PUEBLO";"2";"USERA";"ORCASUR";"28041";"440472";"4468702";"40.366768324753416";"-3.701141063083806";"/contenido/actividades/CursosTalleres";"/usuario/Niños";
11781885;"Club de lectura fácil para mayores de 65 años";"";"1";"1";"M,V";"6/1/2023;7/4/2023;2/5/2023;6/12/2022;";"2022-12-02 00:00:00.0";"2023-06-30 23:59:00.0";"11:00";"";"http://www.madrid.es/sites/v/index.jsp?vgnextchannel=ca9671ee4a9eb410VgnVCM100000171f5a0aRCRD&vgnextoid=e1cb2cb823f53810VgnVCM1000001d4a900aRCRD";"Club de lectura fácil para mayores de 65 años";"http://www.madrid.es/sites/v/index.jsp?vgnextchannel=ca9671ee4a9eb410VgnVCM100000171f5a0aRCRD&vgnextoid=69bf894a1ea53810VgnVCM1000001d4a900aRCRD";"";"";"";"";"";"";"";"";"";"";"";"";"";"";"";
11897795;"Club de lectura infantil BPM Mario Vargas Llosa";"";"1";"1";"J";"16/2/2023;2/3/2023;16/3/2023;30/3/2023;6/4/2023;20/4/2023;4/5/2023;18/5/2023;/6/2023;1/6/2023;";"2023-02-09 00:00:00.0";"2023-06-15 23:59:00.0";"17:30";"";"http://www.madrid.es/sites/v/index.jsp?vgnextchannel=ca9671ee4a9eb410VgnVCM100000171f5a0aRCRD&vgnextoid=1d91f41018aa5810VgnVCM1000001d4a900aRCRD";"";"";"http://www.madrid.es/sites/v/index.jsp?vgnextchannel=bfa48ab43d6bb410VgnVCM100000171f5a0aRCRD&vgnextoid=6c4dbc2658739410VgnVCM2000000c205a0aRCRD";"Biblioteca Pública Municipal Mario Vargas Llosa (Centro)";"1,6";"CALLE";"BARCELO";"4";"CENTRO";"JUSTICIA";"28004";"440645";"4475347";"40.426642215368176";"-3.699722994908341";"/contenido/actividades/ClubesLectura";"/usuario/Niños";
11889788;"Club de lectura 'Soledad no deseada'";"";"1";"0";"";"";"2023-03-09 00:00:00.0";"2023-03-09 23:59:00.0";"12:00";"";"http://www.madrid.es/sites/v/index.jsp?vgnextchannel=ca9671ee4a9eb410VgnVCM100000171f5a0aRCRD&vgnextoid=69d758e974075810VgnVCM2000001f4a900aRCRD";"Club de lectura 'Soledad no deseada'";"http://www.madrid.es/sites/v/index.jsp?vgnextchannel=ca9671ee4a9eb410VgnVCM100000171f5a0aRCRD&vgnextoid=e17758e974075810VgnVCM2000001f4a900aRCRD";"http://www.madrid.es/sites/v/index.jsp?vgnextchannel=bfa48ab43d6bb410VgnVCM100000171f5a0aRCRD&vgnextoid=0b60e92be3c5e210VgnVCM1000000b205a0aRCRD";"Biblioteca Pública Municipal Iván de Vargas (Centro)";"1,6";"CALLE";"SAN JUSTO";"5";"CENTRO";"PALACIO";"28005";"439775";"4473962";"40.41410290844665";"-3.7098591212735883";"/contenido/actividades/ClubesLectura";"";
11889789;"Club de lectura 'Soledad no deseada'";"";"1";"0";"";"";"2023-04-13 00:00:00.0";"2023-04-13 23:59:00.0";"12:00";"";"http://www.madrid.es/sites/v/index.jsp?vgnextchannel=ca9671ee4a9eb410VgnVCM100000171f5a0aRCRD&vgnextoid=2e280d8a7f175810VgnVCM2000001f4a900aRCRD";"Club de lectura 'Soledad no deseada'";"http://www.madrid.es/sites/v/index.jsp?vgnextchannel=ca9671ee4a9eb410VgnVCM100000171f5a0aRCRD&vgnextoid=e17758e974075810VgnVCM2000001f4a900aRCRD";"http://www.madrid.es/sites/v/index.jsp?vgnextchannel=bfa48ab43d6bb410VgnVCM100000171f5a0aRCRD&vgnextoid=0b60e92be3c5e210VgnVCM1000000b205a0aRCRD";"Biblioteca Pública Municipal Iván de Vargas (Centro)";"1,6";"CALLE";"SAN JUSTO";"5";"CENTRO";"PALACIO";"28005";"439775";"4473962";"40.41410290844665";"-3.7098591212735883";"/contenido/actividades/ClubesLectura";"";
11891830;"Club de novela romántica.";"";"1";"1";"J";"9/2/2023;23/2/2023;9/3/2023;23/3/2023;6/4/2023;";"2023-02-02 00:00:00.0";"2023-04-13 23:59:00.0";"18:00";"";"http://www.madrid.es/sites/v/index.jsp?vgnextchannel=ca9671ee4a9eb410VgnVCM100000171f5a0aRCRD&vgnextoid=b4c9b9ffc3e75810VgnVCM2000001f4a900aRCRD";"";"";"http://www.madrid.es/sites/v/index.jsp?vgnextchannel=bfa48ab43d6bb410VgnVCM100000171f5a0aRCRD&vgnextoid=70d879262ef5d010VgnVCM1000000b205a0aRCRD";"Biblioteca Pública Municipal José Saramago (Fuencarral-El Pardo)";"1,6";"AVENIDA";"MONFORTE DE LEMOS";"38";"FUENCARRAL-EL PARDO";"EL PILAR";"28029";"439867";"4481122";"40.47860087334554";"-3.7094408342979954";"/contenido/actividades/ClubesLectura";"";
11940684;"Colectivo Bruxista";"";"1";"0";"";"";"2023-03-03 00:00:00.0";"2023-03-03 23:59:00.0";"19:00";"Colectivo Bruxista es un proyecto editorial independiente que nace a comienzos de 2021 con la intención de publicar textos olvidados, rescatar obras de culto y descubrir nuevos autores en el marco de eso que se ha dado en llamar «cultura de los márgenes». Con la experiencia acumulada durante los años de su anterior proyecto, el fanzine Bruxismo, Colectivo Bruxista ha publicado diversas novelas, biografías y trabajos de fotografía que comparten un interés común por las subculturas pensadas históricamente. El 3 de marzo, repasarán lo que han sido estos dos años en activo, nos presentarán su nuevo título (una historia de fútbol, moda y música a raudales) y nos hablarán del catálogo de 2023. Acceso libre hasta completar aforo.";"http://www.madrid.es/sites/v/index.jsp?vgnextchannel=ca9671ee4a9eb410VgnVCM100000171f5a0aRCRD&vgnextoid=da404c22c3976810VgnVCM2000001f4a900aRCRD";"";"";"http://www.madrid.es/sites/v/index.jsp?vgnextchannel=bfa48ab43d6bb410VgnVCM100000171f5a0aRCRD&vgnextoid=6c4dbc2658739410VgnVCM2000000c205a0aRCRD";"Biblioteca Pública Municipal Mario Vargas Llosa (Centro)";"1,6";"CALLE";"BARCELO";"4";"CENTRO";"JUSTICIA";"28004";"440645";"4475347";"40.426642215368176";"-3.699722994908341";"/contenido/actividades/RecitalesPresentacionesActosLiterarios";"";
11942969;"Conferencia 'Sufragio femenino: las sufragistas españolas' por Miguel Arenas";"";"1";"0";"";"";"2023-03-01 00:00:00.0";"2023-03-01 23:59:00.0";"19:00";"";"http://www.madrid.es/sites/v/index.jsp?vgnextchannel=ca9671ee4a9eb410VgnVCM100000171f5a0aRCRD&vgnextoid=e30b7e6c1f286810VgnVCM1000001d4a900aRCRD";"Conferencia 'Sufragio femenino: las sufragistas españolas' por Miguel Arenas";"http://www.madrid.es/sites/v/index.jsp?vgnextchannel=ca9671ee4a9eb410VgnVCM100000171f5a0aRCRD&vgnextoid=acfe74f89d286810VgnVCM1000001d4a900aRCRD";"http://www.madrid.es/sites/v/index.jsp?vgnextchannel=bfa48ab43d6bb410VgnVCM100000171f5a0aRCRD&vgnextoid=0b60e92be3c5e210VgnVCM1000000b205a0aRCRD";"Biblioteca Pública Municipal Iván de Vargas (Centro)";"1,6";"CALLE";"SAN JUSTO";"5";"CENTRO";"PALACIO";"28005";"439775";"4473962";"40.41410290844665";"-3.7098591212735883";"/contenido/actividades/ConferenciasColoquios";"";
11896731;"Costa de Marfil y Ghana: viaje por África Centro-Occidental";"";"1";"0";"";"";"2023-04-19 00:00:00.0";"2023-04-19 23:59:00.0";"19:00";"La frontera entre Ghana y Costa de Marfil es la línea fronteriza de trazado sur-norte que separa el oeste de Ghana del este de Costa de Marfil en África Occidental. Costa de Marfil fue colonia francesa desde las últimas décadas del siglo XIX y obtuvo su independencia en 1960. Ghana fue colonia británica desde la segunda mitad del siglo XIX y obtuvo su independencia en 1957. Te invitamos a viajar por África Centro-Occidental con esta conferencia que también podrás disfrutar desde casa, dado que será emitida vía Zoom.  ID de reunión 673 720 3049   Código de acceso 6ETT69";"http://www.madrid.es/sites/v/index.jsp?vgnextchannel=ca9671ee4a9eb410VgnVCM100000171f5a0aRCRD&vgnextoid=0fcb114bd85a5810VgnVCM2000001f4a900aRCRD";"Ciclo 'El mundo en la palma de la mano'";"http://www.madrid.es/sites/v/index.jsp?vgnextchannel=ca9671ee4a9eb410VgnVCM100000171f5a0aRCRD&vgnextoid=77a9114bd85a5810VgnVCM2000001f4a900aRCRD";"http://www.madrid.es/sites/v/index.jsp?vgnextchannel=bfa48ab43d6bb410VgnVCM100000171f5a0aRCRD&vgnextoid=e791bed05ceed310VgnVCM1000000b205a0aRCRD";"Biblioteca Pública Municipal Eugenio Trías. Casa de Fieras de El Retiro (Retiro)";"1,6";"PASEO";"FERNÁN NÚÑEZ";"24";"RETIRO";"LOS JERONIMOS";"28009";"442345";"4474221";"40.4166091081099";"-3.6795930368034804";"/contenido/actividades/ConferenciasColoquios";"";
11920111;"Cuentacuentos en inglés: 'A Squash and a Squeeze'";"";"1";"0";"";"";"2023-03-13 00:00:00.0";"2023-03-13 23:59:00.0";"18:00";"International House Madrid nos presenta los 'Cuentacuentos en inglés' con el que los niños y las niñas,acompañados por un adulto, pasarán una inolvidable tarde de diversión contada en inglés.  Inscripciones a través de solicitud electrónica del 27 de febrero al 13 de marzo de 2023.  Dirigido a niñas y niños entre 4 y 7 años.   Aforo máximo: 12  niños/as  y 12 adultos acompañantes.";"http://www.madrid.es/sites/v/index.jsp?vgnextchannel=ca9671ee4a9eb410VgnVCM100000171f5a0aRCRD&vgnextoid=b4c3094ee5716810VgnVCM2000001f4a900aRCRD";"Cuentacuentos en inglés International House Madrid";"http://www.madrid.es/sites/v/index.jsp?vgnextchannel=ca9671ee4a9eb410VgnVCM100000171f5a0aRCRD&vgnextoid=dd3b69c42be25810VgnVCM1000001d4a900aRCRD";"http://www.madrid.es/sites/v/index.jsp?vgnextchannel=bfa48ab43d6bb410VgnVCM100000171f5a0aRCRD&vgnextoid=6c4dbc2658739410VgnVCM2000000c205a0aRCRD";"Biblioteca Pública Municipal Mario Vargas Llosa (Centro)";"1,6";"CALLE";"BARCELO";"4";"CENTRO";"JUSTICIA";"28004";"440645";"4475347";"40.426642215368176";"-3.699722994908341";"/contenido/actividades/CuentacuentosTiteresMarionetas";"/usuario/Niños";
