 ID-EVENTO;TITULO;PRECIO;GRATUITO;LARGA-DURACION;DIAS-SEMANA;DIAS-EXCLUIDOS;FECHA;FECHA-FIN;HORA;DESCRIPCION;CONTENT-URL;TITULO-ACTIVIDAD;URL-ACTIVIDAD;URL-INSTALACION;NOMBRE-INSTALACION;ACCESIBILIDAD-INSTALACION;CLASE-VIAL-INSTALACION;NOMBRE-VIA-INSTALACION;NUM-INSTALACION;DISTRITO-INSTALACION;BARRIO-INSTALACION;CODIGO-POSTAL-INSTALACION;COORDENADA-X;COORDENADA-Y;LATITUD;LONGITUD;TIPO;AUDIENCIA;
11929756;"GPS Literario: Destino: Sudáfrica, primera sesión";"";"1";"0";"";"";"2023-03-09 00:00:00.0";"2023-03-09 23:59:00.0";"18:00";"";"http://www.madrid.es/sites/v/index.jsp?vgnextchannel=ca9671ee4a9eb410VgnVCM100000171f5a0aRCRD&vgnextoid=da5bca5c40056810VgnVCM2000001f4a900aRCRD";"GPS Literario: Destino Sudáfrica";"http://www.madrid.es/sites/v/index.jsp?vgnextchannel=ca9671ee4a9eb410VgnVCM100000171f5a0aRCRD&vgnextoid=e1d4987a0ef46810VgnVCM1000001d4a900aRCRD";"http://www.madrid.es/sites/v/index.jsp?vgnextchannel=bfa48ab43d6bb410VgnVCM100000171f5a0aRCRD&vgnextoid=ec750a2153ef9210VgnVCM2000000c205a0aRCRD";"Biblioteca Pública Municipal Ángel González (Latina)";"1,6";"CALLE";"GRANJA DE TORREHERMOSA";"1";"LATINA";"ALUCHE";"28024";"434954";"4472113";"40.397074625115906";"-3.7664885474841556";"/contenido/actividades/ClubesLectura";"";
11920273;"Grupo de mujeres";"";"1";"1";"V";"";"2023-02-24 00:00:00.0";"2023-03-17 23:59:00.0";"";"Si tienes más de 25 años y te apetece participar en un espacio para abordar juntas el autoconocimiento, la autoestima y la creación de redes de apoyo entre mujeres esta es tu oportunidad. Disfrutaremos juntas, en un espacio de cultura como punto de encuentro, de actividades de ocio y experienciales. Taller a cargo de Maria Aránzazu Lorenzo García, Técnica del Programa de Intervención socio comunitaria. Las sesiones se desarrollarán los siguentes viernes y se podrá asistir al grupo de mañana (de 11:00 a 12:30) o al grupo de tarde (16:30 a 18:00):  24 de febrero. 3 de marzo. 10 de marzo. 17 de marzo.  Necesita inscripción previa en el siguiente formulario.";"http://www.madrid.es/sites/v/index.jsp?vgnextchannel=ca9671ee4a9eb410VgnVCM100000171f5a0aRCRD&vgnextoid=226b266640c16810VgnVCM2000001f4a900aRCRD";"Grupo de mujeres";"http://www.madrid.es/sites/v/index.jsp?vgnextchannel=ca9671ee4a9eb410VgnVCM100000171f5a0aRCRD&vgnextoid=953b266640c16810VgnVCM2000001f4a900aRCRD";"http://www.madrid.es/sites/v/index.jsp?vgnextchannel=bfa48ab43d6bb410VgnVCM100000171f5a0aRCRD&vgnextoid=83e748aaf535e710VgnVCM1000001d4a900aRCRD";"Biblioteca Pública Municipal San Fermín (Usera)";"1,5,6";"AVENIDA";"SAN FERMIN";"10";"USERA";"SAN FERMIN";"28041";"441188";"4469184";"40.3711623444796";"-3.692742821990015";"/contenido/actividades/CursosTalleres";"";
11922328;"Hablar de la depresión es bueno, cuarta parte";"";"1";"0";"";"";"2023-03-22 00:00:00.0";"2023-03-22 23:59:00.0";"18:30";"";"http://www.madrid.es/sites/v/index.jsp?vgnextchannel=ca9671ee4a9eb410VgnVCM100000171f5a0aRCRD&vgnextoid=388fe667fbb26810VgnVCM2000001f4a900aRCRD";"Hablar de la depresión es bueno";"http://www.madrid.es/sites/v/index.jsp?vgnextchannel=ca9671ee4a9eb410VgnVCM100000171f5a0aRCRD&vgnextoid=69c7311a56626810VgnVCM1000001d4a900aRCRD";"http://www.madrid.es/sites/v/index.jsp?vgnextchannel=bfa48ab43d6bb410VgnVCM100000171f5a0aRCRD&vgnextoid=f05279262ef5d010VgnVCM1000000b205a0aRCRD";"Biblioteca Pública Municipal Francisco Ayala (Vicálvaro)";"1,6";"BULEVAR";"INDALECIO PRIETO";"21";"VICALVARO";"VALDEBERNARDO";"28032";"447278";"4472321";"40.39982891410407";"-3.621281890570377";"/contenido/actividades/ConferenciasColoquios";"";
11922324;"Hablar de la depresión es bueno, tercera parte";"";"1";"0";"";"";"2023-03-08 00:00:00.0";"2023-03-08 23:59:00.0";"18:30";"";"http://www.madrid.es/sites/v/index.jsp?vgnextchannel=ca9671ee4a9eb410VgnVCM100000171f5a0aRCRD&vgnextoid=8d5fe667fbb26810VgnVCM2000001f4a900aRCRD";"Hablar de la depresión es bueno";"http://www.madrid.es/sites/v/index.jsp?vgnextchannel=ca9671ee4a9eb410VgnVCM100000171f5a0aRCRD&vgnextoid=69c7311a56626810VgnVCM1000001d4a900aRCRD";"http://www.madrid.es/sites/v/index.jsp?vgnextchannel=bfa48ab43d6bb410VgnVCM100000171f5a0aRCRD&vgnextoid=f05279262ef5d010VgnVCM1000000b205a0aRCRD";"Biblioteca Pública Municipal Francisco Ayala (Vicálvaro)";"1,6";"BULEVAR";"INDALECIO PRIETO";"21";"VICALVARO";"VALDEBERNARDO";"28032";"447278";"4472321";"40.39982891410407";"-3.621281890570377";"/contenido/actividades/ConferenciasColoquios";"";
11920127;"Historia del Barrio del Pilar";"";"1";"1";"L,M,X,J,V";"";"2023-02-02 00:00:00.0";"2023-03-16 23:59:00.0";"18:00";"";"http://www.madrid.es/sites/v/index.jsp?vgnextchannel=ca9671ee4a9eb410VgnVCM100000171f5a0aRCRD&vgnextoid=9c3370f996716810VgnVCM1000001d4a900aRCRD";"Historia del Barrio del Pilar";"http://www.madrid.es/sites/v/index.jsp?vgnextchannel=ca9671ee4a9eb410VgnVCM100000171f5a0aRCRD&vgnextoid=de1370f996716810VgnVCM1000001d4a900aRCRD";"http://www.madrid.es/sites/v/index.jsp?vgnextchannel=bfa48ab43d6bb410VgnVCM100000171f5a0aRCRD&vgnextoid=70d879262ef5d010VgnVCM1000000b205a0aRCRD";"Biblioteca Pública Municipal José Saramago (Fuencarral-El Pardo)";"1,6";"AVENIDA";"MONFORTE DE LEMOS";"38";"FUENCARRAL-EL PARDO";"EL PILAR";"28029";"439867";"4481122";"40.47860087334554";"-3.7094408342979954";"/contenido/actividades/Exposiciones";"";
11834955;"I encuentro de médicos escritores";"";"1";"0";"";"";"2023-03-16 00:00:00.0";"2023-03-16 23:59:00.0";"19:00";"";"http://www.madrid.es/sites/v/index.jsp?vgnextchannel=ca9671ee4a9eb410VgnVCM100000171f5a0aRCRD&vgnextoid=7fa42fc39ad14810VgnVCM1000001d4a900aRCRD";"I encuentro de médicos escritores";"http://www.madrid.es/sites/v/index.jsp?vgnextchannel=ca9671ee4a9eb410VgnVCM100000171f5a0aRCRD&vgnextoid=8b222fc39ad14810VgnVCM1000001d4a900aRCRD";"http://www.madrid.es/sites/v/index.jsp?vgnextchannel=bfa48ab43d6bb410VgnVCM100000171f5a0aRCRD&vgnextoid=e791bed05ceed310VgnVCM1000000b205a0aRCRD";"Biblioteca Pública Municipal Eugenio Trías. Casa de Fieras de El Retiro (Retiro)";"1,6";"PASEO";"FERNÁN NÚÑEZ";"24";"RETIRO";"LOS JERONIMOS";"28009";"442345";"4474221";"40.4166091081099";"-3.6795930368034804";"/contenido/actividades/ConferenciasColoquios";"";
11834958;"I encuentro de médicos escritores";"";"1";"0";"";"";"2023-04-20 00:00:00.0";"2023-04-20 23:59:00.0";"19:00";"";"http://www.madrid.es/sites/v/index.jsp?vgnextchannel=ca9671ee4a9eb410VgnVCM100000171f5a0aRCRD&vgnextoid=61552fc39ad14810VgnVCM1000001d4a900aRCRD";"I encuentro de médicos escritores";"http://www.madrid.es/sites/v/index.jsp?vgnextchannel=ca9671ee4a9eb410VgnVCM100000171f5a0aRCRD&vgnextoid=8b222fc39ad14810VgnVCM1000001d4a900aRCRD";"http://www.madrid.es/sites/v/index.jsp?vgnextchannel=bfa48ab43d6bb410VgnVCM100000171f5a0aRCRD&vgnextoid=e791bed05ceed310VgnVCM1000000b205a0aRCRD";"Biblioteca Pública Municipal Eugenio Trías. Casa de Fieras de El Retiro (Retiro)";"1,6";"PASEO";"FERNÁN NÚÑEZ";"24";"RETIRO";"LOS JERONIMOS";"28009";"442345";"4474221";"40.4166091081099";"-3.6795930368034804";"/contenido/actividades/ConferenciasColoquios";"";
11932687;"Inauguración de la exposición 'Memorias de mujeres. Futuros feministas'";"";"1";"0";"";"";"2023-03-04 00:00:00.0";"2023-03-04 23:59:00.0";"11:30";"Presentación del proyecto y las experiencias que han dado dado como fruto la exposición 'memorias de mujeres. Futuros feministas', que podrá visitarse en la Biblioteca Pública Municipal de San Fermín del 4 al 31 de marzo.";"http://www.madrid.es/sites/v/index.jsp?vgnextchannel=ca9671ee4a9eb410VgnVCM100000171f5a0aRCRD&vgnextoid=eaa5a8a6a3a56810VgnVCM1000001d4a900aRCRD";"Memorias de mujeres. Futuros feministas";"http://www.madrid.es/sites/v/index.jsp?vgnextchannel=ca9671ee4a9eb410VgnVCM100000171f5a0aRCRD&vgnextoid=2c44a8a6a3a56810VgnVCM1000001d4a900aRCRD";"http://www.madrid.es/sites/v/index.jsp?vgnextchannel=bfa48ab43d6bb410VgnVCM100000171f5a0aRCRD&vgnextoid=83e748aaf535e710VgnVCM1000001d4a900aRCRD";"Biblioteca Pública Municipal San Fermín (Usera)";"1,5,6";"AVENIDA";"SAN FERMIN";"10";"USERA";"SAN FERMIN";"28041";"441188";"4469184";"40.3711623444796";"-3.692742821990015";"/contenido/actividades/Exposiciones";"";
11937588;"Inclusión social y atención centrada en la persona. Un reto de futuro";"";"1";"0";"";"";"2023-03-28 00:00:00.0";"2023-03-28 23:59:00.0";"09:00";"";"http://www.madrid.es/sites/v/index.jsp?vgnextchannel=ca9671ee4a9eb410VgnVCM100000171f5a0aRCRD&vgnextoid=da775386d3f66810VgnVCM2000001f4a900aRCRD";"Inclusión Social y Atención Centrada en la Persona";"http://www.madrid.es/sites/v/index.jsp?vgnextchannel=ca9671ee4a9eb410VgnVCM100000171f5a0aRCRD&vgnextoid=6bd65386d3f66810VgnVCM2000001f4a900aRCRD";"http://www.madrid.es/sites/v/index.jsp?vgnextchannel=bfa48ab43d6bb410VgnVCM100000171f5a0aRCRD&vgnextoid=70d879262ef5d010VgnVCM1000000b205a0aRCRD";"Biblioteca Pública Municipal José Saramago (Fuencarral-El Pardo)";"1,6";"AVENIDA";"MONFORTE DE LEMOS";"38";"FUENCARRAL-EL PARDO";"EL PILAR";"28029";"439867";"4481122";"40.47860087334554";"-3.7094408342979954";"/contenido/actividades/ConferenciasColoquios";"/usuario/PersonasEmergenciaSocial,/usuario/OtrosColectivosNecesitados";
11892218;"Johann Sebastian Bach: vida y obra - vocal e instrumental";"";"1";"0";"";"";"2023-03-15 00:00:00.0";"2023-03-15 23:59:00.0";"19:00";"";"http://www.madrid.es/sites/v/index.jsp?vgnextchannel=ca9671ee4a9eb410VgnVCM100000171f5a0aRCRD&vgnextoid=75aaeb41dd185810VgnVCM1000001d4a900aRCRD";"";"";"http://www.madrid.es/sites/v/index.jsp?vgnextchannel=bfa48ab43d6bb410VgnVCM100000171f5a0aRCRD&vgnextoid=6c4dbc2658739410VgnVCM2000000c205a0aRCRD";"Biblioteca Pública Municipal Mario Vargas Llosa (Centro)";"1,6";"CALLE";"BARCELO";"4";"CENTRO";"JUSTICIA";"28004";"440645";"4475347";"40.426642215368176";"-3.699722994908341";"/contenido/actividades/ConferenciasColoquios";"";
11912561;"La Gran Vía: otra manera de viajar";"";"1";"0";"";"";"2023-03-09 00:00:00.0";"2023-03-09 23:59:00.0";"18:30";"";"http://www.madrid.es/sites/v/index.jsp?vgnextchannel=ca9671ee4a9eb410VgnVCM100000171f5a0aRCRD&vgnextoid=2e2964e315306810VgnVCM2000001f4a900aRCRD";"";"";"http://www.madrid.es/sites/v/index.jsp?vgnextchannel=bfa48ab43d6bb410VgnVCM100000171f5a0aRCRD&vgnextoid=70d879262ef5d010VgnVCM1000000b205a0aRCRD";"Biblioteca Pública Municipal José Saramago (Fuencarral-El Pardo)";"1,6";"AVENIDA";"MONFORTE DE LEMOS";"38";"FUENCARRAL-EL PARDO";"EL PILAR";"28029";"439867";"4481122";"40.47860087334554";"-3.7094408342979954";"/contenido/actividades/ConferenciasColoquios";"";
11926005;"La hora del cuento";"";"1";"1";"X";"";"2023-02-22 00:00:00.0";"2023-06-22 23:59:00.0";"18:00";"";"http://www.madrid.es/sites/v/index.jsp?vgnextchannel=ca9671ee4a9eb410VgnVCM100000171f5a0aRCRD&vgnextoid=17e2795e39a36810VgnVCM2000001f4a900aRCRD";"La hora del cuento en San Fermín";"http://www.madrid.es/sites/v/index.jsp?vgnextchannel=ca9671ee4a9eb410VgnVCM100000171f5a0aRCRD&vgnextoid=1b62795e39a36810VgnVCM2000001f4a900aRCRD";"http://www.madrid.es/sites/v/index.jsp?vgnextchannel=bfa48ab43d6bb410VgnVCM100000171f5a0aRCRD&vgnextoid=83e748aaf535e710VgnVCM1000001d4a900aRCRD";"Biblioteca Pública Municipal San Fermín (Usera)";"1,5,6";"AVENIDA";"SAN FERMIN";"10";"USERA";"SAN FERMIN";"28041";"441188";"4469184";"40.3711623444796";"-3.692742821990015";"/contenido/actividades/CuentacuentosTiteresMarionetas";"/usuario/Niños,/usuario/Familias";
11785047;"La hora del cuento en  Mario Vargas LLosa";"";"1";"1";"X";"";"2022-10-05 00:00:00.0";"2023-04-26 23:59:00.0";"17:30";"";"http://www.madrid.es/sites/v/index.jsp?vgnextchannel=ca9671ee4a9eb410VgnVCM100000171f5a0aRCRD&vgnextoid=5c817e65b6973810VgnVCM2000001f4a900aRCRD";"La hora del cuento en  Mario Vargas LLosa";"http://www.madrid.es/sites/v/index.jsp?vgnextchannel=ca9671ee4a9eb410VgnVCM100000171f5a0aRCRD&vgnextoid=4fc46d8172973810VgnVCM2000001f4a900aRCRD";"http://www.madrid.es/sites/v/index.jsp?vgnextchannel=bfa48ab43d6bb410VgnVCM100000171f5a0aRCRD&vgnextoid=6c4dbc2658739410VgnVCM2000000c205a0aRCRD";"Biblioteca Pública Municipal Mario Vargas Llosa (Centro)";"1,6";"CALLE";"BARCELO";"4";"CENTRO";"JUSTICIA";"28004";"440645";"4475347";"40.426642215368176";"-3.699722994908341";"/contenido/actividades/CuentacuentosTiteresMarionetas";"/usuario/Niños";
11594640;"La Hora del cuento en María Zambrano";"";"1";"1";"M";"27/9/2022;11/10/2022;25/10/2022;8/11/2022;22/11/2022;20/12/2022;10/1/2023;24/1/2023;7/2/2023;21/2/2023;7/3/2023;21/3/2023;4/4/2023;18/4/2023;2/5/2023;16/5/2023;";"2022-09-27 00:00:00.0";"2023-05-16 23:59:00.0";"17:30";"";"http://www.madrid.es/sites/v/index.jsp?vgnextchannel=ca9671ee4a9eb410VgnVCM100000171f5a0aRCRD&vgnextoid=5ef0c3f72c9de710VgnVCM2000001f4a900aRCRD";"La hora del cuento en María Zambrano";"http://www.madrid.es/sites/v/index.jsp?vgnextchannel=ca9671ee4a9eb410VgnVCM100000171f5a0aRCRD&vgnextoid=abe0c3f72c9de710VgnVCM2000001f4a900aRCRD";"http://www.madrid.es/sites/v/index.jsp?vgnextchannel=bfa48ab43d6bb410VgnVCM100000171f5a0aRCRD&vgnextoid=74703d0b5e71c010VgnVCM1000000b205a0aRCRD";"Biblioteca Pública Municipal María Zambrano (Tetuán)";"1,6";"PLAZA";"DONOSO";"5";"TETUAN";"ALMENARA";"28029";"440857";"4480052";"40.46903299144094";"-3.6976620067964996";"/contenido/actividades/CuentacuentosTiteresMarionetas";"/usuario/Niños";
11889144;"La puertas de Yuendumu: arte aborigen australiano en la Biblioteca Pública Municipal San Fermín";"";"1";"1";"L,M,X,J,V,S,D";"";"2023-01-01 00:00:00.0";"2023-02-28 23:59:00.0";"08:30";"";"http://www.madrid.es/sites/v/index.jsp?vgnextchannel=ca9671ee4a9eb410VgnVCM100000171f5a0aRCRD&vgnextoid=1d79d93c7f265810VgnVCM2000001f4a900aRCRD";"";"";"http://www.madrid.es/sites/v/index.jsp?vgnextchannel=bfa48ab43d6bb410VgnVCM100000171f5a0aRCRD&vgnextoid=83e748aaf535e710VgnVCM1000001d4a900aRCRD";"Biblioteca Pública Municipal San Fermín (Usera)";"1,5,6";"AVENIDA";"SAN FERMIN";"10";"USERA";"SAN FERMIN";"28041";"441188";"4469184";"40.3711623444796";"-3.692742821990015";"/contenido/actividades/Exposiciones";"";
11930065;"Las mujeres cuidadoras en el 8 marzo: charla emocional de cruz roja. !Con un montón de deseos!";"";"1";"0";"";"";"2023-03-08 00:00:00.0";"2023-03-08 23:59:00.0";"12:00";"";"http://www.madrid.es/sites/v/index.jsp?vgnextchannel=ca9671ee4a9eb410VgnVCM100000171f5a0aRCRD&vgnextoid=544ed80d87056810VgnVCM2000001f4a900aRCRD";"";"";"http://www.madrid.es/sites/v/index.jsp?vgnextchannel=bfa48ab43d6bb410VgnVCM100000171f5a0aRCRD&vgnextoid=70d879262ef5d010VgnVCM1000000b205a0aRCRD";"Biblioteca Pública Municipal José Saramago (Fuencarral-El Pardo)";"1,6";"AVENIDA";"MONFORTE DE LEMOS";"38";"FUENCARRAL-EL PARDO";"EL PILAR";"28029";"439867";"4481122";"40.47860087334554";"-3.7094408342979954";"/contenido/actividades/ConferenciasColoquios";"";
11678622;"Let's practice english!";"";"1";"1";"M";"";"2023-01-10 00:00:00.0";"2023-12-26 23:59:00.0";"18:30";"";"http://www.madrid.es/sites/v/index.jsp?vgnextchannel=ca9671ee4a9eb410VgnVCM100000171f5a0aRCRD&vgnextoid=a0d53192d3490810VgnVCM2000001f4a900aRCRD";"";"";"http://www.madrid.es/sites/v/index.jsp?vgnextchannel=bfa48ab43d6bb410VgnVCM100000171f5a0aRCRD&vgnextoid=70d879262ef5d010VgnVCM1000000b205a0aRCRD";"Biblioteca Pública Municipal José Saramago (Fuencarral-El Pardo)";"1,6";"AVENIDA";"MONFORTE DE LEMOS";"38";"FUENCARRAL-EL PARDO";"EL PILAR";"28029";"439867";"4481122";"40.47860087334554";"-3.7094408342979954";"/contenido/actividades/CursosTalleres";"";
11854074;"Ludoteca en la Biblioteca Ángel González";"";"1";"1";"S";"";"2022-12-03 00:00:00.0";"2023-06-24 23:59:00.0";"09:30";"";"http://www.madrid.es/sites/v/index.jsp?vgnextchannel=ca9671ee4a9eb410VgnVCM100000171f5a0aRCRD&vgnextoid=50a99392d9f94810VgnVCM1000001d4a900aRCRD";"Ludoteca en la Biblioteca Ángel González";"http://www.madrid.es/sites/v/index.jsp?vgnextchannel=ca9671ee4a9eb410VgnVCM100000171f5a0aRCRD&vgnextoid=32099392d9f94810VgnVCM1000001d4a900aRCRD";"http://www.madrid.es/sites/v/index.jsp?vgnextchannel=bfa48ab43d6bb410VgnVCM100000171f5a0aRCRD&vgnextoid=ec750a2153ef9210VgnVCM2000000c205a0aRCRD";"Biblioteca Pública Municipal Ángel González (Latina)";"1,6";"CALLE";"GRANJA DE TORREHERMOSA";"1";"LATINA";"ALUCHE";"28024";"434954";"4472113";"40.397074625115906";"-3.7664885474841556";"/contenido/actividades/CursosTalleres";"";
11932472;"Maravillas mi paisaje urbano de Tribunal a Conde Duque";"";"1";"1";"L,M,X,J,V";"";"2023-02-17 00:00:00.0";"2023-03-30 23:59:00.0";"08:30";"";"http://www.madrid.es/sites/v/index.jsp?vgnextchannel=ca9671ee4a9eb410VgnVCM100000171f5a0aRCRD&vgnextoid=1b3df32301a56810VgnVCM2000001f4a900aRCRD";"Maravillas mi paisaje urbano de Tribunal a Conde Duque";"http://www.madrid.es/sites/v/index.jsp?vgnextchannel=ca9671ee4a9eb410VgnVCM100000171f5a0aRCRD&vgnextoid=8cf8f32301a56810VgnVCM2000001f4a900aRCRD";"http://www.madrid.es/sites/v/index.jsp?vgnextchannel=bfa48ab43d6bb410VgnVCM100000171f5a0aRCRD&vgnextoid=13ec3d0b5e71c010VgnVCM1000000b205a0aRCRD";"Biblioteca Pública Municipal Benito Pérez Galdós (Centro)";"1,6";"CALLE";"CONDE DUQUE";"9";"CENTRO";"UNIVERSIDAD";"28015";"439723";"4475438";"40.42738668300474";"-3.7105999955473625";"/contenido/actividades/Exposiciones";"";
11932712;"Medicina tradicional china: reino de la madera";"";"1";"0";"";"";"2023-03-28 00:00:00.0";"2023-03-28 23:59:00.0";"18:30";"Taller de medicina china teniendo como enfoque el reino madera, impartido por Thamar Arias. La medicina china es el nombre que se da comúnmente a un rango de prácticas médicas tradicionales y supersticiones desarrolladas en China a lo largo de su evolución cultural milenaria. Los principales fundamentos teóricos médicos de la medicina tradicional china se basan en esta larga experiencia, y queda reflejada en la teoría del yin-yang y otras, como la doctrina de los cinco elementos. Inscríbete en este enlace.";"http://www.madrid.es/sites/v/index.jsp?vgnextchannel=ca9671ee4a9eb410VgnVCM100000171f5a0aRCRD&vgnextoid=6027a8a6a3a56810VgnVCM1000001d4a900aRCRD";"Medicina tradicional china: reino de la madera";"http://www.madrid.es/sites/v/index.jsp?vgnextchannel=ca9671ee4a9eb410VgnVCM100000171f5a0aRCRD&vgnextoid=e407a8a6a3a56810VgnVCM1000001d4a900aRCRD";"http://www.madrid.es/sites/v/index.jsp?vgnextchannel=bfa48ab43d6bb410VgnVCM100000171f5a0aRCRD&vgnextoid=697c598d1351c010VgnVCM1000000b205a0aRCRD";"Biblioteca Pública Municipal La Elipa (Ciudad Lineal)";"1,6";"CALLE";"NUESTRA SEÑORA DEL VILLAR";"6";"CIUDAD LINEAL";"LA ELIPA";"28017";"444705";"4474959";"40.42342659084215";"-3.651841641389484";"/contenido/actividades/ConferenciasColoquios";"";
11932690;"Memorias de mujeres. Futuros feministas";"";"1";"1";"L,M,X,J,V,S,D";"20/3/2023;";"2023-03-04 00:00:00.0";"2023-03-31 23:59:00.0";"";"La memoria de las mujeres, a lo largo de la historia, ha sido poco reconocida. Las mujeres han sido protagonistas de mil tareas para conformar el mundo y darle vida, pero se les ha invisibilizado. Obreras, madres, estudiantes, cuidadoras, intelectuales, activistas. Migrantes, venidas de lejos y de cerca de nuestra ciudad, llegadas a estos barrios de Usera, donde fueron acogidas y se convirtieron en su lugar en el mundo, en su casa. En este proyecto queremos mostraros algunas de sus historias de vida. Diversas, sencillas, duras. Unas, solas e impotentes, otras, felices y poderosas.";"http://www.madrid.es/sites/v/index.jsp?vgnextchannel=ca9671ee4a9eb410VgnVCM100000171f5a0aRCRD&vgnextoid=e1e5a8a6a3a56810VgnVCM1000001d4a900aRCRD";"";"";"http://www.madrid.es/sites/v/index.jsp?vgnextchannel=bfa48ab43d6bb410VgnVCM100000171f5a0aRCRD&vgnextoid=83e748aaf535e710VgnVCM1000001d4a900aRCRD";"Biblioteca Pública Municipal San Fermín (Usera)";"1,5,6";"AVENIDA";"SAN FERMIN";"10";"USERA";"SAN FERMIN";"28041";"441188";"4469184";"40.3711623444796";"-3.692742821990015";"/contenido/actividades/Exposiciones";"";
11931388;"Mujeres en la Gran Guerra. Imagen y realidad";"";"1";"0";"";"";"2023-03-01 00:00:00.0";"2023-03-01 23:59:00.0";"18:30";"La obra se compone de dos partes, la primera contiene cinco textos históricos que recogen el análisis de investigadoras referentes del feminismo español que nos invitan a reflexionar y reconocer el papel de las mujeres en la Primera Guerra Mundial. La segunda muestra numerosos registros gráficos (carteles propagandísticos y fotografías) donde reconocer y observar como este conflicto marcó un antes y un después en la realidad vital, por la igualdad, de las mujeres en Europa. Autores: Juanma Serna; Oliva Blanco; Marian López; Susana Tavera; Diana Raznovich; María Cueva. Editorial Biblioteca Añil Feminista. Acceso libre hasta completar aforo.";"http://www.madrid.es/sites/v/index.jsp?vgnextchannel=ca9671ee4a9eb410VgnVCM100000171f5a0aRCRD&vgnextoid=9f59eec17c556810VgnVCM2000001f4a900aRCRD";"";"";"http://www.madrid.es/sites/v/index.jsp?vgnextchannel=bfa48ab43d6bb410VgnVCM100000171f5a0aRCRD&vgnextoid=e791bed05ceed310VgnVCM1000000b205a0aRCRD";"Biblioteca Pública Municipal Eugenio Trías. Casa de Fieras de El Retiro (Retiro)";"1,6";"PASEO";"FERNÁN NÚÑEZ";"24";"RETIRO";"LOS JERONIMOS";"28009";"442345";"4474221";"40.4166091081099";"-3.6795930368034804";"/contenido/actividades/RecitalesPresentacionesActosLiterarios";"";
11932738;"Música para el recuerdo: entre nosotros";"";"1";"0";"";"";"2023-03-10 00:00:00.0";"2023-03-10 23:59:00.0";"18:00";"";"http://www.madrid.es/sites/v/index.jsp?vgnextchannel=ca9671ee4a9eb410VgnVCM100000171f5a0aRCRD&vgnextoid=fd4532fea4a56810VgnVCM2000001f4a900aRCRD";"";"";"http://www.madrid.es/sites/v/index.jsp?vgnextchannel=bfa48ab43d6bb410VgnVCM100000171f5a0aRCRD&vgnextoid=70d879262ef5d010VgnVCM1000000b205a0aRCRD";"Biblioteca Pública Municipal José Saramago (Fuencarral-El Pardo)";"1,6";"AVENIDA";"MONFORTE DE LEMOS";"38";"FUENCARRAL-EL PARDO";"EL PILAR";"28029";"439867";"4481122";"40.47860087334554";"-3.7094408342979954";"/contenido/actividades/Musica";"";
11938246;"Nostalgia del cielo de Ramón López Pazos";"";"1";"0";"";"";"2023-03-14 00:00:00.0";"2023-03-14 23:59:00.0";"19:30";"";"http://www.madrid.es/sites/v/index.jsp?vgnextchannel=ca9671ee4a9eb410VgnVCM100000171f5a0aRCRD&vgnextoid=ccb9012e88376810VgnVCM1000001d4a900aRCRD";"";"";"http://www.madrid.es/sites/v/index.jsp?vgnextchannel=bfa48ab43d6bb410VgnVCM100000171f5a0aRCRD&vgnextoid=e791bed05ceed310VgnVCM1000000b205a0aRCRD";"Biblioteca Pública Municipal Eugenio Trías. Casa de Fieras de El Retiro (Retiro)";"1,6";"PASEO";"FERNÁN NÚÑEZ";"24";"RETIRO";"LOS JERONIMOS";"28009";"442345";"4474221";"40.4166091081099";"-3.6795930368034804";"/contenido/actividades/RecitalesPresentacionesActosLiterarios";"";
11913893;"Palabras habitadas: reconocimiento de la conciencia para crear una mente en paz";"";"1";"0";"";"";"2023-03-10 00:00:00.0";"2023-03-10 23:59:00.0";"19:00";"Tercera conferencia del ciclo 'Una cita con el corazón: Cómo cultivar la paz interior', con Luis Castellanos. Acceso libre hasta completar aforo.";"http://www.madrid.es/sites/v/index.jsp?vgnextchannel=ca9671ee4a9eb410VgnVCM100000171f5a0aRCRD&vgnextoid=133a2ba513806810VgnVCM1000001d4a900aRCRD";"Ciclo 'Una cita con el corazón: cómo cultiva la paz interior'";"http://www.madrid.es/sites/v/index.jsp?vgnextchannel=ca9671ee4a9eb410VgnVCM100000171f5a0aRCRD&vgnextoid=2eeb02f785306810VgnVCM1000001d4a900aRCRD";"http://www.madrid.es/sites/v/index.jsp?vgnextchannel=bfa48ab43d6bb410VgnVCM100000171f5a0aRCRD&vgnextoid=e791bed05ceed310VgnVCM1000000b205a0aRCRD";"Biblioteca Pública Municipal Eugenio Trías. Casa de Fieras de El Retiro (Retiro)";"1,6";"PASEO";"FERNÁN NÚÑEZ";"24";"RETIRO";"LOS JERONIMOS";"28009";"442345";"4474221";"40.4166091081099";"-3.6795930368034804";"/contenido/actividades/ConferenciasColoquios";"";
11933655;"Personajes Siniestros de la Historia.Ranavalona y Jack el Destripador";"";"1";"0";"";"";"2023-03-10 00:00:00.0";"2023-03-10 23:59:00.0";"18:30";"";"http://www.madrid.es/sites/v/index.jsp?vgnextchannel=ca9671ee4a9eb410VgnVCM100000171f5a0aRCRD&vgnextoid=7b50c22a6fe56810VgnVCM2000001f4a900aRCRD";"";"";"http://www.madrid.es/sites/v/index.jsp?vgnextchannel=bfa48ab43d6bb410VgnVCM100000171f5a0aRCRD&vgnextoid=628e3d0b5e71c010VgnVCM1000000b205a0aRCRD";"Biblioteca Pública Municipal Ana María Matute (Carabanchel)";"1,6";"CALLE";"ISAAC ALBENIZ";"1";"CARABANCHEL";"SAN ISIDRO";"28019";"438891";"4472167";"40.39786734087938";"-3.720088245008897";"/contenido/actividades/ConferenciasColoquios";"";
11933819;"Personajes Siniestros de la Historia: Leopoldo II de Bélgica y Stalin";"";"1";"0";"";"";"2023-03-31 00:00:00.0";"2023-03-31 23:59:00.0";"18:30";"";"http://www.madrid.es/sites/v/index.jsp?vgnextchannel=ca9671ee4a9eb410VgnVCM100000171f5a0aRCRD&vgnextoid=930d8d3561f56810VgnVCM2000001f4a900aRCRD";"";"";"http://www.madrid.es/sites/v/index.jsp?vgnextchannel=bfa48ab43d6bb410VgnVCM100000171f5a0aRCRD&vgnextoid=628e3d0b5e71c010VgnVCM1000000b205a0aRCRD";"Biblioteca Pública Municipal Ana María Matute (Carabanchel)";"1,6";"CALLE";"ISAAC ALBENIZ";"1";"CARABANCHEL";"SAN ISIDRO";"28019";"438891";"4472167";"40.39786734087938";"-3.720088245008897";"/contenido/actividades/ConferenciasColoquios";"";
11933864;"Personajes Siniestros de la Historia: Pol Pot Idi Amin y resumen final";"";"1";"0";"";"";"2023-04-21 00:00:00.0";"2023-04-21 23:59:00.0";"18:30";"";"http://www.madrid.es/sites/v/index.jsp?vgnextchannel=ca9671ee4a9eb410VgnVCM100000171f5a0aRCRD&vgnextoid=3e3e8d3561f56810VgnVCM2000001f4a900aRCRD";"";"";"http://www.madrid.es/sites/v/index.jsp?vgnextchannel=bfa48ab43d6bb410VgnVCM100000171f5a0aRCRD&vgnextoid=628e3d0b5e71c010VgnVCM1000000b205a0aRCRD";"Biblioteca Pública Municipal Ana María Matute (Carabanchel)";"1,6";"CALLE";"ISAAC ALBENIZ";"1";"CARABANCHEL";"SAN ISIDRO";"28019";"438891";"4472167";"40.39786734087938";"-3.720088245008897";"/contenido/actividades/ConferenciasColoquios";"";
