 ID-EVENTO;TITULO;PRECIO;GRATUITO;LARGA-DURACION;DIAS-SEMANA;DIAS-EXCLUIDOS;FECHA;FECHA-FIN;HORA;DESCRIPCION;CONTENT-URL;TITULO-ACTIVIDAD;URL-ACTIVIDAD;URL-INSTALACION;NOMBRE-INSTALACION;ACCESIBILIDAD-INSTALACION;CLASE-VIAL-INSTALACION;NOMBRE-VIA-INSTALACION;NUM-INSTALACION;DISTRITO-INSTALACION;BARRIO-INSTALACION;CODIGO-POSTAL-INSTALACION;COORDENADA-X;COORDENADA-Y;LATITUD;LONGITUD;TIPO;AUDIENCIA;
11887899;"Tertulia Literaria Hispanoamericana Rafael Montesinos";"";"1";"0";"";"";"2023-03-21 00:00:00.0";"2023-03-21 23:59:00.0";"19:00";"Se conmemoran los 70 años de la Tertulia Literaria Hispanoamericana Rafael Montesinos, que es la tertulia poética y literaria más longeva, con actividad continuada, del mundo hispánico. Por ello hemos programado seis sesiones, de enero a junio, en las que cuatro poetas por sesión y que en su mayoría ya intervinieron en otros cursos en la Tertulia, leerán poemas inéditos. Así, y siguiendo una tradición de la Tertulia, se rompe la costumbre de leer poesía publicada durante la clásica presentación del libro de poemas. Este 21 de marzo en la Biblioteca P.M. Eugenio Trías, Casa de Fieras de El Retiro tendrá lugar la tercera de las seis sesiones poéticas y que inicia el ciclo Poemas Inéditos.";"http://www.madrid.es/sites/v/index.jsp?vgnextchannel=ca9671ee4a9eb410VgnVCM100000171f5a0aRCRD&vgnextoid=474f607658d55810VgnVCM1000001d4a900aRCRD";"";"";"http://www.madrid.es/sites/v/index.jsp?vgnextchannel=bfa48ab43d6bb410VgnVCM100000171f5a0aRCRD&vgnextoid=e791bed05ceed310VgnVCM1000000b205a0aRCRD";"Biblioteca Pública Municipal Eugenio Trías. Casa de Fieras de El Retiro (Retiro)";"1,6";"PASEO";"FERNÁN NÚÑEZ";"24";"RETIRO";"LOS JERONIMOS";"28009";"442345";"4474221";"40.4166091081099";"-3.6795930368034804";"/contenido/actividades/RecitalesPresentacionesActosLiterarios";"";
11883622;"Tertulias en latín";"";"1";"1";"V";"";"2022-12-30 00:00:00.0";"2023-06-30 23:59:00.0";"19:00";"";"http://www.madrid.es/sites/v/index.jsp?vgnextchannel=ca9671ee4a9eb410VgnVCM100000171f5a0aRCRD&vgnextoid=95412edbb5355810VgnVCM1000001d4a900aRCRD";"";"";"http://www.madrid.es/sites/v/index.jsp?vgnextchannel=bfa48ab43d6bb410VgnVCM100000171f5a0aRCRD&vgnextoid=0b60e92be3c5e210VgnVCM1000000b205a0aRCRD";"Biblioteca Pública Municipal Iván de Vargas (Centro)";"1,6";"CALLE";"SAN JUSTO";"5";"CENTRO";"PALACIO";"28005";"439775";"4473962";"40.41410290844665";"-3.7098591212735883";"/contenido/actividades/CursosTalleres";"";
11827511;"The Accidental Tourist";"";"1";"0";"";"";"2023-03-06 00:00:00.0";"2023-03-06 23:59:00.0";"17:30";"";"http://www.madrid.es/sites/v/index.jsp?vgnextchannel=ca9671ee4a9eb410VgnVCM100000171f5a0aRCRD&vgnextoid=3538748b489f3810VgnVCM2000001f4a900aRCRD";"Cine en inglés en la Biblioteca Mario Vargas Llosa";"http://www.madrid.es/sites/v/index.jsp?vgnextchannel=ca9671ee4a9eb410VgnVCM100000171f5a0aRCRD&vgnextoid=05a9c1cc649f3810VgnVCM2000001f4a900aRCRD";"http://www.madrid.es/sites/v/index.jsp?vgnextchannel=bfa48ab43d6bb410VgnVCM100000171f5a0aRCRD&vgnextoid=6c4dbc2658739410VgnVCM2000000c205a0aRCRD";"Biblioteca Pública Municipal Mario Vargas Llosa (Centro)";"1,6";"CALLE";"BARCELO";"4";"CENTRO";"JUSTICIA";"28004";"440645";"4475347";"40.426642215368176";"-3.699722994908341";"/contenido/actividades/CineActividadesAudiovisuales";"";
11907587;"Torneo de Catán en la Biblioteca Eugenio Trías";"";"1";"0";"";"";"2023-04-21 00:00:00.0";"2023-04-21 23:59:00.0";"";"Jornada clasificatoria del I Torneo de Catan Interbibliotecario organizado por La Red de Bibliotecas Públicas del Ayuntamiento de Madrid. En esta tarde de juego que se celebrará en la Biblioteca Eugenio Trías, podrás sumar puntos y clasificarte. Posteriormente, los mejores de cada biblioteca se medirán en semifinales, de donde saldrán los cuatro finalistas.Todos los finalistas tendrán premio seguro. Si tienes entre 9 y 15 años te esperamos, tienes hasta el 20 de abril para apuntarte en este  enlace .";"http://www.madrid.es/sites/v/index.jsp?vgnextchannel=ca9671ee4a9eb410VgnVCM100000171f5a0aRCRD&vgnextoid=ce041eddcd7e5810VgnVCM2000001f4a900aRCRD";"I Torneo de Catán";"http://www.madrid.es/sites/v/index.jsp?vgnextchannel=ca9671ee4a9eb410VgnVCM100000171f5a0aRCRD&vgnextoid=16ec24b59b3e5810VgnVCM2000001f4a900aRCRD";"http://www.madrid.es/sites/v/index.jsp?vgnextchannel=bfa48ab43d6bb410VgnVCM100000171f5a0aRCRD&vgnextoid=e791bed05ceed310VgnVCM1000000b205a0aRCRD";"Biblioteca Pública Municipal Eugenio Trías. Casa de Fieras de El Retiro (Retiro)";"1,6";"PASEO";"FERNÁN NÚÑEZ";"24";"RETIRO";"LOS JERONIMOS";"28009";"442345";"4474221";"40.4166091081099";"-3.6795930368034804";"/contenido/actividades/ConcursosCertamenes";"/usuario/Jovenes,/usuario/Niños";
11907547;"Torneo de Catán en la Biblioteca Iván de Vargas";"";"1";"0";"";"";"2023-03-17 00:00:00.0";"2023-03-17 23:59:00.0";"";"Jornada clasificatoria del I Torneo de Catan Interbibliotecario organizado por La Red de Bibliotecas Públicas del Ayuntamiento de Madrid. En esta tarde de juego que se celebrará en la Biblioteca Iván de Vargas, podrás sumar puntos y clasificarte. Posteriormente, los mejores de cada biblioteca se medirán en semifinales, de donde saldrán los cuatro finalistas.Todos los finalistas tendrán premio seguro. Si tienes entre 9 y 15 años te esperamos, tienes hasta el 20 de abril para apuntarte en este  enlace .";"http://www.madrid.es/sites/v/index.jsp?vgnextchannel=ca9671ee4a9eb410VgnVCM100000171f5a0aRCRD&vgnextoid=a5831eddcd7e5810VgnVCM2000001f4a900aRCRD";"I Torneo de Catán";"http://www.madrid.es/sites/v/index.jsp?vgnextchannel=ca9671ee4a9eb410VgnVCM100000171f5a0aRCRD&vgnextoid=16ec24b59b3e5810VgnVCM2000001f4a900aRCRD";"http://www.madrid.es/sites/v/index.jsp?vgnextchannel=bfa48ab43d6bb410VgnVCM100000171f5a0aRCRD&vgnextoid=0b60e92be3c5e210VgnVCM1000000b205a0aRCRD";"Biblioteca Pública Municipal Iván de Vargas (Centro)";"1,6";"CALLE";"SAN JUSTO";"5";"CENTRO";"PALACIO";"28005";"439775";"4473962";"40.41410290844665";"-3.7098591212735883";"/contenido/actividades/ConcursosCertamenes";"/usuario/Jovenes,/usuario/Niños";
11936381;"Una fiera en mi pecera";"";"1";"0";"";"";"2023-03-01 00:00:00.0";"2023-03-01 23:59:00.0";"18:00";"";"http://www.madrid.es/sites/v/index.jsp?vgnextchannel=ca9671ee4a9eb410VgnVCM100000171f5a0aRCRD&vgnextoid=302e9ede40e66810VgnVCM1000001d4a900aRCRD";"Una fiera en mi pecera";"http://www.madrid.es/sites/v/index.jsp?vgnextchannel=ca9671ee4a9eb410VgnVCM100000171f5a0aRCRD&vgnextoid=8ada5ba1b2483810VgnVCM2000001f4a900aRCRD";"http://www.madrid.es/sites/v/index.jsp?vgnextchannel=bfa48ab43d6bb410VgnVCM100000171f5a0aRCRD&vgnextoid=e791bed05ceed310VgnVCM1000000b205a0aRCRD";"Biblioteca Pública Municipal Eugenio Trías. Casa de Fieras de El Retiro (Retiro)";"1,6";"PASEO";"FERNÁN NÚÑEZ";"24";"RETIRO";"LOS JERONIMOS";"28009";"442345";"4474221";"40.4166091081099";"-3.6795930368034804";"/contenido/actividades/CuentacuentosTiteresMarionetas";"/usuario/Niños";
11806152;"Ven a jugar a la biblioteca";"";"1";"1";"V";"28/10/2022;4/11/2022;11/11/2022;25/11/2022;2/12/2022;9/12/2022;16/12/2022;30/12/2022;";"2023-02-03 00:00:00.0";"2023-06-30 23:59:00.0";"18:00";"";"http://www.madrid.es/sites/v/index.jsp?vgnextchannel=ca9671ee4a9eb410VgnVCM100000171f5a0aRCRD&vgnextoid=add0616ee28a3810VgnVCM2000001f4a900aRCRD";"Ven a jugar a la biblioteca";"http://www.madrid.es/sites/v/index.jsp?vgnextchannel=ca9671ee4a9eb410VgnVCM100000171f5a0aRCRD&vgnextoid=51a0616ee28a3810VgnVCM2000001f4a900aRCRD";"http://www.madrid.es/sites/v/index.jsp?vgnextchannel=bfa48ab43d6bb410VgnVCM100000171f5a0aRCRD&vgnextoid=338879262ef5d010VgnVCM1000000b205a0aRCRD";"Biblioteca Pública Municipal José Hierro (San Blas-Canillejas)";"1,6";"CALLE";"MARIA SEVILLA DIAGO";"15";"SAN BLAS-CANILLEJAS";"ROSAS";"28022";"448214";"4476029";"40.433291625973624";"-3.6105662311927453";"/contenido/actividades/CursosTalleres";"/usuario/Niños,/usuario/Familias";
11942405;"Visita guiada al Museo de Historia de Madrid";"";"1";"0";"";"";"2023-03-21 00:00:00.0";"2023-03-21 23:59:00.0";"12:00";"Si te gusta la historia de Madrid y conocer la colección permanente del Museo, apúntate a nuestra visita guiada. Responsable del recorrido: Begoña Domíngez Iniesta. Inscríbete en este enlace.";"http://www.madrid.es/sites/v/index.jsp?vgnextchannel=ca9671ee4a9eb410VgnVCM100000171f5a0aRCRD&vgnextoid=6c7cd537b1f76810VgnVCM1000001d4a900aRCRD";"";"";"http://www.madrid.es/sites/v/index.jsp?vgnextchannel=bfa48ab43d6bb410VgnVCM100000171f5a0aRCRD&vgnextoid=f05279262ef5d010VgnVCM1000000b205a0aRCRD";"Biblioteca Pública Municipal Francisco Ayala (Vicálvaro)";"1,6";"BULEVAR";"INDALECIO PRIETO";"21";"VICALVARO";"VALDEBERNARDO";"28032";"447278";"4472321";"40.39982891410407";"-3.621281890570377";"/contenido/actividades/ExcursionesItinerariosVisitas";"";
11842098;"Visita guiada: 'Beatriz Galindo, Madrid mudéjar, Las Vistillas y alrededores'";"";"1";"0";"";"";"2023-03-21 00:00:00.0";"2023-03-21 23:59:00.0";"11:00";"";"http://www.madrid.es/sites/v/index.jsp?vgnextchannel=ca9671ee4a9eb410VgnVCM100000171f5a0aRCRD&vgnextoid=7f50608378254810VgnVCM1000001d4a900aRCRD";"Visita guiada: 'Beatriz Galindo, Madrid mudéjar, Las Vistillas y alrededores'";"http://www.madrid.es/sites/v/index.jsp?vgnextchannel=ca9671ee4a9eb410VgnVCM100000171f5a0aRCRD&vgnextoid=fa40608378254810VgnVCM1000001d4a900aRCRD";"http://www.madrid.es/sites/v/index.jsp?vgnextchannel=bfa48ab43d6bb410VgnVCM100000171f5a0aRCRD&vgnextoid=697c598d1351c010VgnVCM1000000b205a0aRCRD";"Biblioteca Pública Municipal La Elipa (Ciudad Lineal)";"1,6";"CALLE";"NUESTRA SEÑORA DEL VILLAR";"6";"CIUDAD LINEAL";"LA ELIPA";"28017";"444705";"4474959";"40.42342659084215";"-3.651841641389484";"/contenido/actividades/ExcursionesItinerariosVisitas";"";
11918983;"Visita guiada: 'El Real Sitio del Retiro'";"";"1";"0";"";"";"2023-04-25 00:00:00.0";"2023-04-25 23:59:00.0";"11:00";"Visita guiada por el Real Sitio del Buen Retiro donde aprenderemos la historia, los secretos y las anécdotas más significantes de un Real Sitio concebido para el recreo de los reyes españoles.   Inscripciones del 2 de febrero al 20 de abril en el mostrador de la biblioteca o a través de   solicitud electrónica  .";"http://www.madrid.es/sites/v/index.jsp?vgnextchannel=ca9671ee4a9eb410VgnVCM100000171f5a0aRCRD&vgnextoid=fa01913968616810VgnVCM1000001d4a900aRCRD";"Visita guiada: 'El Real Sitio del Retiro'";"http://www.madrid.es/sites/v/index.jsp?vgnextchannel=ca9671ee4a9eb410VgnVCM100000171f5a0aRCRD&vgnextoid=690d913968616810VgnVCM1000001d4a900aRCRD";"http://www.madrid.es/sites/v/index.jsp?vgnextchannel=bfa48ab43d6bb410VgnVCM100000171f5a0aRCRD&vgnextoid=697c598d1351c010VgnVCM1000000b205a0aRCRD";"Biblioteca Pública Municipal La Elipa (Ciudad Lineal)";"1,6";"CALLE";"NUESTRA SEÑORA DEL VILLAR";"6";"CIUDAD LINEAL";"LA ELIPA";"28017";"444705";"4474959";"40.42342659084215";"-3.651841641389484";"/contenido/actividades/ExcursionesItinerariosVisitas";"";
11914051;"Visita guiada: 'Mujeres notables'";"";"1";"0";"";"";"2023-03-01 00:00:00.0";"2023-03-01 23:59:00.0";"11:00";"";"http://www.madrid.es/sites/v/index.jsp?vgnextchannel=ca9671ee4a9eb410VgnVCM100000171f5a0aRCRD&vgnextoid=e19f670db2806810VgnVCM2000001f4a900aRCRD";"";"";"http://www.madrid.es/sites/v/index.jsp?vgnextchannel=bfa48ab43d6bb410VgnVCM100000171f5a0aRCRD&vgnextoid=697c598d1351c010VgnVCM1000000b205a0aRCRD";"Biblioteca Pública Municipal La Elipa (Ciudad Lineal)";"1,6";"CALLE";"NUESTRA SEÑORA DEL VILLAR";"6";"CIUDAD LINEAL";"LA ELIPA";"28017";"444705";"4474959";"40.42342659084215";"-3.651841641389484";"/contenido/actividades/ExcursionesItinerariosVisitas";"";
11938315;"'Efímero mosaico' de Antonio Portillo";"";"1";"0";"";"";"2023-03-31 00:00:00.0";"2023-03-31 23:59:00.0";"19:00";"";"http://www.madrid.es/sites/v/index.jsp?vgnextchannel=ca9671ee4a9eb410VgnVCM100000171f5a0aRCRD&vgnextoid=e280012e88376810VgnVCM1000001d4a900aRCRD";"";"";"http://www.madrid.es/sites/v/index.jsp?vgnextchannel=bfa48ab43d6bb410VgnVCM100000171f5a0aRCRD&vgnextoid=e791bed05ceed310VgnVCM1000000b205a0aRCRD";"Biblioteca Pública Municipal Eugenio Trías. Casa de Fieras de El Retiro (Retiro)";"1,6";"PASEO";"FERNÁN NÚÑEZ";"24";"RETIRO";"LOS JERONIMOS";"28009";"442345";"4474221";"40.4166091081099";"-3.6795930368034804";"/contenido/actividades/RecitalesPresentacionesActosLiterarios";"";
11809970;"'Egipto faraónico. Una historia fascinante'";"";"1";"0";"";"";"2023-03-07 00:00:00.0";"2023-03-07 23:59:00.0";"18:30";"";"http://www.madrid.es/sites/v/index.jsp?vgnextchannel=ca9671ee4a9eb410VgnVCM100000171f5a0aRCRD&vgnextoid=7c019d7d931c3810VgnVCM2000001f4a900aRCRD";"'Egipto faraónico. Una historia fascinante'";"http://www.madrid.es/sites/v/index.jsp?vgnextchannel=ca9671ee4a9eb410VgnVCM100000171f5a0aRCRD&vgnextoid=49435125f1e73810VgnVCM2000001f4a900aRCRD";"http://www.madrid.es/sites/v/index.jsp?vgnextchannel=bfa48ab43d6bb410VgnVCM100000171f5a0aRCRD&vgnextoid=e791bed05ceed310VgnVCM1000000b205a0aRCRD";"Biblioteca Pública Municipal Eugenio Trías. Casa de Fieras de El Retiro (Retiro)";"1,6";"PASEO";"FERNÁN NÚÑEZ";"24";"RETIRO";"LOS JERONIMOS";"28009";"442345";"4474221";"40.4166091081099";"-3.6795930368034804";"/contenido/actividades/ConferenciasColoquios";"";
11809972;"'Egipto faraónico. Una historia fascinante'";"";"1";"0";"";"";"2023-04-11 00:00:00.0";"2023-04-11 23:59:00.0";"18:30";"";"http://www.madrid.es/sites/v/index.jsp?vgnextchannel=ca9671ee4a9eb410VgnVCM100000171f5a0aRCRD&vgnextoid=54319d7d931c3810VgnVCM2000001f4a900aRCRD";"'Egipto faraónico. Una historia fascinante'";"http://www.madrid.es/sites/v/index.jsp?vgnextchannel=ca9671ee4a9eb410VgnVCM100000171f5a0aRCRD&vgnextoid=49435125f1e73810VgnVCM2000001f4a900aRCRD";"http://www.madrid.es/sites/v/index.jsp?vgnextchannel=bfa48ab43d6bb410VgnVCM100000171f5a0aRCRD&vgnextoid=e791bed05ceed310VgnVCM1000000b205a0aRCRD";"Biblioteca Pública Municipal Eugenio Trías. Casa de Fieras de El Retiro (Retiro)";"1,6";"PASEO";"FERNÁN NÚÑEZ";"24";"RETIRO";"LOS JERONIMOS";"28009";"442345";"4474221";"40.4166091081099";"-3.6795930368034804";"/contenido/actividades/ConferenciasColoquios";"";
11930633;"'El inventario. La noche de Bartolomé'";"";"1";"0";"";"";"2023-03-14 00:00:00.0";"2023-03-14 23:59:00.0";"19:00";"";"http://www.madrid.es/sites/v/index.jsp?vgnextchannel=ca9671ee4a9eb410VgnVCM100000171f5a0aRCRD&vgnextoid=7b83894048456810VgnVCM2000001f4a900aRCRD";"'El inventario. La noche de Bartolomé'";"http://www.madrid.es/sites/v/index.jsp?vgnextchannel=ca9671ee4a9eb410VgnVCM100000171f5a0aRCRD&vgnextoid=1652dfd197456810VgnVCM1000001d4a900aRCRD";"http://www.madrid.es/sites/v/index.jsp?vgnextchannel=bfa48ab43d6bb410VgnVCM100000171f5a0aRCRD&vgnextoid=6c4dbc2658739410VgnVCM2000000c205a0aRCRD";"Biblioteca Pública Municipal Mario Vargas Llosa (Centro)";"1,6";"CALLE";"BARCELO";"4";"CENTRO";"JUSTICIA";"28004";"440645";"4475347";"40.426642215368176";"-3.699722994908341";"/contenido/actividades/RecitalesPresentacionesActosLiterarios";"";
11936928;"'Rodencia y el diente de la princesa'";"";"1";"0";"";"";"2023-03-03 00:00:00.0";"2023-03-03 23:59:00.0";"18:00";"Proyección de la película 'Rodencia y el diente de la princesa' el día 3 de marzo para niños y niñas a partir de 5 años, en nuestras sesiones de cine infantil que tienen lugar los viernes alternos a las 18:00 horas. Sinopsis: Cuenta una antigua leyenda que dentro de un inmenso y salvaje bosque, existe un fantástico reino: Rodencia, un lugar habitado por criaturas maravillosas y poderosos magos. 'En Rodencia y el Diente de la Princesa cuenta las aventuras del pequeño Edam, un torpe aprendiz de mago, junto a la bella y segura ratoncita BRIE; acompañados de los más grandes guerreros del reino iniciarán un increíble viaje, donde se enfrentarán a los más sorprendentes peligros para obtener un mágico y legendario poder y así derrotar a las oscuras fuerzas comandadas por el malvado hechicero Rotex, rey de las ratas, que amenaza con invadir Rodencia'.     Necesita inscripción previa, enlace al formulario.";"http://www.madrid.es/sites/v/index.jsp?vgnextchannel=ca9671ee4a9eb410VgnVCM100000171f5a0aRCRD&vgnextoid=83d994050be66810VgnVCM1000001d4a900aRCRD";"Cine infantil en la Biblioteca La Elipa";"http://www.madrid.es/sites/v/index.jsp?vgnextchannel=ca9671ee4a9eb410VgnVCM100000171f5a0aRCRD&vgnextoid=71e0ee0fe6bbc710VgnVCM2000001f4a900aRCRD";"http://www.madrid.es/sites/v/index.jsp?vgnextchannel=bfa48ab43d6bb410VgnVCM100000171f5a0aRCRD&vgnextoid=697c598d1351c010VgnVCM1000000b205a0aRCRD";"Biblioteca Pública Municipal La Elipa (Ciudad Lineal)";"1,6";"CALLE";"NUESTRA SEÑORA DEL VILLAR";"6";"CIUDAD LINEAL";"LA ELIPA";"28017";"444705";"4474959";"40.42342659084215";"-3.651841641389484";"/contenido/actividades/CineActividadesAudiovisuales";"/usuario/Niños";
11930089;"'Vivo en la carretera', de Pablo Herrero Coria";"";"0";"1";"L,M,X,J,V";"20/3/2023;";"2023-03-01 00:00:00.0";"2023-03-30 23:59:00.0";"";"La presente exposición nos llega tras su paso 'por la carretera' por Galicia a Madrid. Su autor nos dice 'siendo una selección de fotos de los más de cien conciertos cubiertos por el portal/editorial y medio de comunicación Ratón de Biblioteca por el mismo. Fueron concretamente los Festivales más importantes del Norte de la provincia de La Coruña en el 2012 como el 'Festival Celta de Ortigueira', 'Festival 13 Muertes' de Ferrol, 'Brincadeira festival' y 'Rock en Cambre', 'Beira Rock' en Mugardos y 'Las fiestas de Ferrol 2012'. Son fotografías individualistas que pretenden acercar los artistas a la vista del público donde ellos no llegan ya que se realizaron en el foso de los escenarios con objetivos telex. Dentro de ellas están grupos de 'Alemania' o el propio cantante de 'Herdeiros da Cruz'. ¿Interesante? ¡Éste es tu momento de verlas! ¡Te esperamos de lunes a viernes, de 8:30 a 21:00 horas!";"http://www.madrid.es/sites/v/index.jsp?vgnextchannel=ca9671ee4a9eb410VgnVCM100000171f5a0aRCRD&vgnextoid=d8eed80d87056810VgnVCM2000001f4a900aRCRD";"";"";"http://www.madrid.es/sites/v/index.jsp?vgnextchannel=bfa48ab43d6bb410VgnVCM100000171f5a0aRCRD&vgnextoid=6c4dbc2658739410VgnVCM2000000c205a0aRCRD";"Biblioteca Pública Municipal Mario Vargas Llosa (Centro)";"1,6";"CALLE";"BARCELO";"4";"CENTRO";"JUSTICIA";"28004";"440645";"4475347";"40.426642215368176";"-3.699722994908341";"/contenido/actividades/Exposiciones";"";
11942311;"'Crónicas de un planeta herido', edición de Diana García Corona";"";"1";"0";"";"";"2023-03-07 00:00:00.0";"2023-03-07 23:59:00.0";"19:00";"Presentación de la antología Crónicas de un planeta herido que reúne, en dieciocho relatos de ficción de distintos autores, una mirada múltiple sobre el cambio climático. En ellos, el lector podrá encontrar el negro de unas pupilas, a seiscientos años luz, que se extiende y crea de golpe la noche ártica; podrá dejarse absorber los efluvios por una abeja recolectora o escuchar la música del violinista que une lo bello y lo terrible de la humanidad a un tiempo. Desde la preocupación por nuestro planeta, estos relatos nos acercan las metáforas de un futuro incierto: hermosas nubes transformadas en amenazas invisibles, animales que se acercan desde los secretos de la selva o la desaparición de los inviernos de un metro de nieve. Acceso libre hasta completar aforo.";"http://www.madrid.es/sites/v/index.jsp?vgnextchannel=ca9671ee4a9eb410VgnVCM100000171f5a0aRCRD&vgnextoid=1dd70c7635e76810VgnVCM1000001d4a900aRCRD";"";"";"http://www.madrid.es/sites/v/index.jsp?vgnextchannel=bfa48ab43d6bb410VgnVCM100000171f5a0aRCRD&vgnextoid=ec750a2153ef9210VgnVCM2000000c205a0aRCRD";"Biblioteca Pública Municipal Ángel González (Latina)";"1,6";"CALLE";"GRANJA DE TORREHERMOSA";"1";"LATINA";"ALUCHE";"28024";"434954";"4472113";"40.397074625115906";"-3.7664885474841556";"/contenido/actividades/RecitalesPresentacionesActosLiterarios";"";
11938034;"'Delfos, el lugar sagrado de Apolo y Dionisos: oráculos, sibilas, ménades y héroes'";"";"1";"0";"";"";"2023-03-30 00:00:00.0";"2023-03-30 23:59:00.0";"18:00";"Dentro del ciclo de conferencias 'Mitos de la Antigua Grecia y su expresión en el Arte', esta sesión estará dedicada a 'Delfos, el lugar sagrado de Apolo y Dionisos: oráculos, sibilas, ménades y héroes' donde  se analizará la importancia que en la Antigüedad tuvieron los oráculos, los dioses que los presidían y las sibilas que los pronunciaban";"http://www.madrid.es/sites/v/index.jsp?vgnextchannel=ca9671ee4a9eb410VgnVCM100000171f5a0aRCRD&vgnextoid=dc8fd0bdd2376810VgnVCM1000001d4a900aRCRD";"Ciclo 'Mitos de la Antigua Grecia y su expresión en el Arte'";"http://www.madrid.es/sites/v/index.jsp?vgnextchannel=ca9671ee4a9eb410VgnVCM100000171f5a0aRCRD&vgnextoid=784dd0bdd2376810VgnVCM1000001d4a900aRCRD";"http://www.madrid.es/sites/v/index.jsp?vgnextchannel=bfa48ab43d6bb410VgnVCM100000171f5a0aRCRD&vgnextoid=0b60e92be3c5e210VgnVCM1000000b205a0aRCRD";"Biblioteca Pública Municipal Iván de Vargas (Centro)";"1,6";"CALLE";"SAN JUSTO";"5";"CENTRO";"PALACIO";"28005";"439775";"4473962";"40.41410290844665";"-3.7098591212735883";"/contenido/actividades/ConferenciasColoquios";"";
11938029;"'Dioses y héroes de la guerra de Troya'";"";"1";"0";"";"";"2023-03-16 00:00:00.0";"2023-03-16 23:59:00.0";"18:00";"Dentro del ciclo de conferencias 'Mitos de la Antigua Grecia y su expresión en el Arte', esta sesión estará dedicada a 'Dioses y héroes de la guerra de Troya' donde se abordará la visión idealizada en los mitos de la guerra de Troya, y la importancia que en la Antigüedad tuvieron los oráculos, los dioses que los presidían y las sibilas que los pronunciaban.";"http://www.madrid.es/sites/v/index.jsp?vgnextchannel=ca9671ee4a9eb410VgnVCM100000171f5a0aRCRD&vgnextoid=561fd0bdd2376810VgnVCM1000001d4a900aRCRD";"Ciclo 'Mitos de la Antigua Grecia y su expresión en el Arte'";"http://www.madrid.es/sites/v/index.jsp?vgnextchannel=ca9671ee4a9eb410VgnVCM100000171f5a0aRCRD&vgnextoid=784dd0bdd2376810VgnVCM1000001d4a900aRCRD";"http://www.madrid.es/sites/v/index.jsp?vgnextchannel=bfa48ab43d6bb410VgnVCM100000171f5a0aRCRD&vgnextoid=0b60e92be3c5e210VgnVCM1000000b205a0aRCRD";"Biblioteca Pública Municipal Iván de Vargas (Centro)";"1,6";"CALLE";"SAN JUSTO";"5";"CENTRO";"PALACIO";"28005";"439775";"4473962";"40.41410290844665";"-3.7098591212735883";"/contenido/actividades/ConferenciasColoquios";"";
11938865;"'El enigma del llanto' de Mª Pilar Gándara";"";"1";"0";"";"";"2023-03-30 00:00:00.0";"2023-03-30 23:59:00.0";"18:00";"";"http://www.madrid.es/sites/v/index.jsp?vgnextchannel=ca9671ee4a9eb410VgnVCM100000171f5a0aRCRD&vgnextoid=24fc6cc6d5476810VgnVCM2000001f4a900aRCRD";"'El enigma del llanto' de la autora Mª Pilar Gándara";"http://www.madrid.es/sites/v/index.jsp?vgnextchannel=ca9671ee4a9eb410VgnVCM100000171f5a0aRCRD&vgnextoid=14ec6cc6d5476810VgnVCM2000001f4a900aRCRD";"http://www.madrid.es/sites/v/index.jsp?vgnextchannel=bfa48ab43d6bb410VgnVCM100000171f5a0aRCRD&vgnextoid=70d879262ef5d010VgnVCM1000000b205a0aRCRD";"Biblioteca Pública Municipal José Saramago (Fuencarral-El Pardo)";"1,6";"AVENIDA";"MONFORTE DE LEMOS";"38";"FUENCARRAL-EL PARDO";"EL PILAR";"28029";"439867";"4481122";"40.47860087334554";"-3.7094408342979954";"/contenido/actividades/RecitalesPresentacionesActosLiterarios";"";
11942320;"'Kira ayuda a su mamá' y taller de manualidades";"";"1";"0";"";"";"2023-03-07 00:00:00.0";"2023-03-07 23:59:00.0";"18:00";"La autora e ilustradora María Sastre nos presentará su primer libro 'Kira ayuda a su mamá'. Una preciosa historia llena de amor. Después de la lectura se realizará un taller con pasta blanca para modelar y elementos de la naturaleza para decorar.  Para niños y niñas de 4 a 8 años.  Inscríbete en este enlace.";"http://www.madrid.es/sites/v/index.jsp?vgnextchannel=ca9671ee4a9eb410VgnVCM100000171f5a0aRCRD&vgnextoid=b2f8d537b1f76810VgnVCM1000001d4a900aRCRD";"";"";"http://www.madrid.es/sites/v/index.jsp?vgnextchannel=bfa48ab43d6bb410VgnVCM100000171f5a0aRCRD&vgnextoid=f05279262ef5d010VgnVCM1000000b205a0aRCRD";"Biblioteca Pública Municipal Francisco Ayala (Vicálvaro)";"1,6";"BULEVAR";"INDALECIO PRIETO";"21";"VICALVARO";"VALDEBERNARDO";"28032";"447278";"4472321";"40.39982891410407";"-3.621281890570377";"/contenido/actividades/CuentacuentosTiteresMarionetas";"/usuario/Niños";
11938023;"'La acrópolis de Atenas': el lugar sagrado disputado por Atenea y Poseidón'";"";"1";"0";"";"";"2023-03-02 00:00:00.0";"2023-03-02 23:59:00.0";"18:00";"Dentro del ciclo de conferencias 'Mitos de la Antigua Grecia y su expresión en el Arte', esta sesión estará dedicada a 'La acrópolis de Atenas: el lugar sagrado disputado por Atenea y Poseidón'.    La Acrópolis era un lugar característico de la mayoría de las ciudades griegas que poseía la función defensiva, además de funcionar como sede de los principales lugares de culto.      Los primeros habitantes que podemos rastrear en la Acrópolis de Atenas fueron los reyes micénicos, que fortificaron la roca con enormes muros de ocho metros de altura y construyeron allí sus palacios en el siglo XIV a.C.";"http://www.madrid.es/sites/v/index.jsp?vgnextchannel=ca9671ee4a9eb410VgnVCM100000171f5a0aRCRD&vgnextoid=a01fd0bdd2376810VgnVCM1000001d4a900aRCRD";"Ciclo 'Mitos de la Antigua Grecia y su expresión en el Arte'";"http://www.madrid.es/sites/v/index.jsp?vgnextchannel=ca9671ee4a9eb410VgnVCM100000171f5a0aRCRD&vgnextoid=784dd0bdd2376810VgnVCM1000001d4a900aRCRD";"http://www.madrid.es/sites/v/index.jsp?vgnextchannel=bfa48ab43d6bb410VgnVCM100000171f5a0aRCRD&vgnextoid=0b60e92be3c5e210VgnVCM1000000b205a0aRCRD";"Biblioteca Pública Municipal Iván de Vargas (Centro)";"1,6";"CALLE";"SAN JUSTO";"5";"CENTRO";"PALACIO";"28005";"439775";"4473962";"40.41410290844665";"-3.7098591212735883";"/contenido/actividades/ConferenciasColoquios";"";
